0	enak nih kalau di sini steak nya apalagi burger nya , lokasi nya strategis pakai tempat nongkrong juga bisa soal nya dekat kampus juga
0	dah tidak terhingga berapa kali makan di parit dan jarang sekali kecewa . menu fav : ikan kerapu masak tim hongkong , kepiting saos tiram , udang saos mentega , jus alpuket , kerang rebus , and many more . makan seafood segar dan puas tetapi sesuai harga hanya di sini tempat nya .
0	terima kasih hadiah pulsa nya sudah saya terima amp ; sangat bermanfaat :
0	betah banget diri dan suka maksimal sama konsep nya , di dalem nya ada yang jualan kerak telor di panggul begitu . makanan nya juga sesuai sama harga nya , dan cara memanggil pelayan nya harus memukul pentungan , green tea latte enak , cuma sirloin steak nya agak keras , saung tempat makan nya juga manis banget poko nya suka !
2	dulu kaum babi menyebut ketua komnas ham , natalius pigai sebagai monyet manusia hitam gara-gara membela habib rizieq , nah sekarang ketika komnas menyerang fahri hamzah , kaum babi malah muji-muji komnas ham . dasar penjilat .
0	tempat makan yang menyenangkan , interior nya unik dan suasana nya asik . menu nya variatif , pancake nya enak dan tidak monoton . porsi nya cukup besar dan mengenyangkan . selain pancake ada menu pasta juga bila ingin makan yang lain . walaupun harga nya cukup mahal , tapi bisa dibilang sepadan dengan kualitas nya
2	baru di era presiden jokowi wakil rakyat yang nota bene wakil ketua dpr selalu menyerang presiden , pemerintah tidak bikin adem negri tapi malah bikin panas . bubarkan saja dpr rakyat tidak perlu wakil yang brengsek .
2	tidak sopan
0	rasa mie nya mantap . ditambah otot kaki sapi yang kenyal-kenyal . ditemani krupuk kriuk . wajib coba kalau berkunjung ke bandung ! harga nya juga murah .
2	jogja miskin , tolol dan tak berbudaya . teman-teman jakarta - bandung jangan mau tinggal di jogja
1	nyai pesantren di gresik deklarasi dukung gus ipul
1	prognosis kerawanan pemilu 2019 dapat ditelusuri berdasarkan ipc pada pemilu 2014 yaitu diidentifikasi 14 kerawanan pemilu .
2	pks itu partai korupsi sapi ya
0	ketika digigit enak , lalu terasa bumbu yang khas di lidah . dicampur dengan sambal nya lalu saus nya , rasa khas tadi semakin kuat . rasa khas ini entah dari apa nya , mungkin tidak semua orang menyukai nya . untuk yang suka , bisa bikin ketagihan . untuk yang kurang suka , mungkin akan cari yang lain . selamat mencoba .
0	saat saya kuliah tahun 2002 - 2007 , saya pernah mencoba sebuah bakmi rica di dekat kampus . saya pikir itu adalah bakmi rica kejaksaan yang terkenal selama ini . ternyata bukan . setelah saya datang langsung ke bakmie rica di jalan kejaksaan ini , saya baru melihat perbedaan nya . mi rica nya memang enak banget . pedas , porsi mengenyangkan . pelayanan nya pun sangat cepat .
2	jokowi adalah anak pki 100 % . gue bingung kata apa yang pantas disematkan untuk si joko babi .
0	jika sedang di cihampelas dan cari oleh-oleh coba mampir ke odjolali makanan ringan . banyak pilihan makanan ringan dan harga nya bersaing . tidak hanya oleh-oleh atau cemilan khas bandung seperti aneka keripik , batagor instan , atau seblak , ada pula oleh-oleh khas dari berbagai daerah lainnya .
2	cina tidak boleh jadi pejabat bung , soal nya cina itu komunis
0	penasaran sudah lama mau ke sini , alhamdulillah kesampaian . perjuangan ke sini nya . saran : jika saat perjalanan ke sana hujan sangat disarankan putar balik ! kenapa ? karena jalanan setapak menuju ke sana masih belum aspal semua . jadi jika tidak mahir mengendarai mobil , agak ngeri juga karena tanah yang licin dan samping kanan / kiri jalan seperti jurang . tapi ketika sudah sampai , semua jadi terbayarkan .
2	baru kemarin saya dan teman teman yang lain buka bersama di etc , untuk lokasi lumayan , tempat standart , harga tidak sebanding dengan rasa , biasa saja , biasa sekali , tidak rekomendasi ,
1	sudah sebulan lebih tidak makan indomie , sekali nya makan langsung bikin dua porsi indomie goreng jumbo .
0	nasi goreng nya enak dan kepedasan nya bisa disesuaikan dengan level nya cobalah nasi goreng preman , gangster dan yakuza , baru berani pedes nya sampai level merisaukan saja
2	kopi kapal api makin ke sini rasanya makin kurang hamud
2	maklumlah kalau jokowi itu baperan , klaim meng klaim memang itu saja bisa nya , pokok nya presiden ri satu ini alay , lebay , capcay dan puyung hai .
0	beragam menu bakso tahu dan berbagai menu minuman yang beragam membuat raja bakso tahu saboga saya rekomendasikan bumbu kacang yang manis dan pedas juga enak
0	braga permai has been on jalan bragaweg sejak 1923 . from the dutch colonial periode , bragaweg adalah the most famous street in bandung . in the colonial periode , braga permai called maison bogerijen . saya pesan lama chop . juara banget . kabohidrat nya disajikan dengan ubi merah . andai daging kambing nya tanpa lemak mungkin lebih sehat tapi bukan problemlah . secara keseluruhan baik , ini lampu chop juara .
0	mau makan enak dan terjangkau di pvj ? ke sago saja . coba beli kerupuk kampung yang disiram saos kacang . enak deh . nasi goreng nya juga enak . ada juga mi jawa , dan aneka hidangan khas pecinan jawa .
0	pilihan seperti baso-baso dan lain-lainnya banyak di sini macam-macam dan unik-unik . selain suki di sini juga bisa bakar-bakar an
2	ini yang perlu kita ingatkan kalau nanti pemerintah agama islam , maka kami nyatakan kami ajak umat islam ayo mari perangi ahmadiyah , bunuh ahmadiyah di mana pun mereka berada , saudara . allahu akbar , bunuh , bunuh , bunuh .
0	menikmati makan malam di bandung menyempatkan untuk mencicipi masakan kedai belacan . tempat yang cukup strategis dengan parkir yang bisa menampung bis rombongan kami . menu ayam bakar daun pisang menu yang layak untuk dipilih . cita rasa rempah yang kuat dipadu dengan aroma daun pembungkus pembakaran sangat nyaman di lidah . suasana makan malam dengan sajian life musik makin menambah nikmat santap malam .
0	baru saja kami sekeluarga makan di congo , bermain di playground , dan menikmati ambience bandung malam hari . ternyata kami lupa mengambil gadget di area bermain . pada pukul 11 malam kami menghubungi congo dan manager saat itu bapak heri berjanji mencari nya . alhamdulillah barang tersebut masih ada . terima kasih banyak kepada bp heri atas servis dan atensi nya , beliau sampai mengantarkan ke hotel kami .
0	tempat makan dengan suasana alam ini paling tepat untuk acara dengan pasangan atau dengan keluarga . makanan nya enak dan harga juga cukup terjangkau
1	moreno mencuat , prabowo tahan dulu
1	keren , ditantang menteri susi , sandiaga gelar festival danau sunter
0	bakso nya enak . favorit saya bakso urat dan bakso pedas dengan isi daging cincang rawit yang bikin mata molotot . patut dicoba juga nasi bakso lada hitam . tiap malam ramai terlebih akhir pekan .
0	resto dengan pemandangan yang bagus , suasana sejuk dan nyaman , untuk makan harga cukup mahal karena hotel berbintang , untuk rasa cukup baik
0	warung steak atau lebih dikenal ws , memang menyajikan hidangan berbagai macam steak yang murah dan lezat , tanpa sengaja mengunjungi warung steak ini karena diajak oleh pasangan , dan setelah mencicipi ternyata rasa dan harga sangat berbanding terbalik , steak yang sangat lezat dengan harga yang sangat murah sehingga sering saya mengunjungi warung steak ini , untuk makanan yang sering saya pesan adalah steak .
0	menemukan kafe ini di sebelah heritage fo . harga terjangkau dan rasanya enak rekomendasi : 1 . nasi goreng kampung 2 . miso chicken katsu 3 . japanese matcha milk tea
2	sirik tanda tak mampu , kayak prabowo anjir
2	lu agama buddha sesat , terserah ! tidak penting berdebat sama orang kampungan kayak lu , tahu enggak
2	mm sedih deh kalau ke sini selalu menunggu : mie nya pedas banget . hehe bangku nya juga tambahkan dong biar tidak menunggu
0	saya suka dengan rasa steak tenderolin nya . masak nya pas , matang , dan bumbu nya enak . lokasi nya juga strategis dnegan suasana restoran yang tenang mendukung selera makan
2	salah satu driver ojol surabaya menyamakan allah dengan dajjal . maksud nya dia yang dajjal kali .
0	untuk suasana nya enak dan dingin , menjelang sore akan lebih terasa apabila obor-obor di depan saung dinyalakan , pemandangan air buatan dan bunyi gemericik air menyenangkan sekali , kampung daun menjadi salah satu tempat favorit keluarga saya .
0	setelah keliling mencari kafe yang nyaman dan sepi ahir nya kita pilih sierra kafe walaupun awal nya agak ragu karena super ramai banget mengingat ini malam minggu setelah masuk agak pusing melihat rame nya , hampir semua meja penuh , dan itu super ramai , akhirnya kita pilih duduk di semi di luar , pemandangan nya memang bagus cuma karena ramai jadi agak susah untuk tak foto yang bagus .
0	makanan yang ditawarkan variatif banget , mulai dari orang cina makanan , indonesian food , makanan barat , japanese . sampai jajanan-jajanan seperti lumpia basah , jagung bakar . sangat ramai di malam hari , ditambah dengan parkiran dan akses nya harus menggunakan kendaraan .
0	kota bandung terkenal dengan kuliner - nya , termasuk di antara nya brownies kukus amanda yang dimulai tadinya dari industri rumah nya . brownies ini sekarang sudah berkembang dan memiliki banyak varian rasa , di samping rasa original tiramisu favorit saya ! sering dijadikan oleh-oleh untuk teman / kolega bila bepergian ke luar kota .
1	isran noor dan hadi mulyadi unggul dengan mengantongi 31,3 persen suara .
0	salah satu tempat nongkrong yang romantis di bandung , kafe nya sangat unik , untuk harga juga variatif dan standar dengan kafe lainnya , parkir juga sangat luas , pelayanan juga baik , pertama baru ke sini langsung suka dengan tempat ini
2	tidak sukses
1	lanjutkan , kata sby
2	mending jangan masuk sekolah kristen . nanti kamu di kristenisasi loh .
0	kami dan beberapa teman makan siang du queen restoran . restoran ini sejak zaman orang tua saya juga sering mampir makan siang atau malam di queen restoran . di bandung boleh di katakan no. 1 untuk masakan chinese makanan nya . pesanan cukup cepat . pelayan nya banyak . dan cekatan .
1	untuk perihal pergantian rekening untuk pembayaran autodebet bpjs , bpk luqman bisa datang ke kantor cbg bank mandiri pengajuan autodebet tersebut ya untuk dapat dilakukan pemberhentian terlebih dahulu .
2	minimal kalau tidak mau tak asu asu ke tolong stabilitas sinyal 4 tidak untuk wilayah stadion maguwoharjo - candi sambisari kalasan diy
0	dengan harga rp . 5,000 / tusuk bersiaplah mengeluarkan kocek rp . 100,000 untuk 20 tusuk . dijamin daging kambing nya tak berbau , empuk , dan anda bisa meminta untuk dipanggang lebih lama / tidak sesuai keinginan anda . sop tulang nya ramai dan maknyus .
2	saya tidak suka beliau jokowi yang masih jadi presiden
0	tidak malas
0	menyenangkan makan bersama keluarga dan teman di braga permai staf ramah sayang makanan nya ada kekurangan . daging chesse burger nya kurang matang dan kentang nya juga bukan kentang yang baru digoreng . nasi goreng kepiting nya enak cuma masak nya kurang sempurna , sebagian keasinan dan sebagian kurang asin jika ingin memesan ice cream sebaiknya dadakan saja karena keburu lumer ice krim nya .
1	sosok arianti dewi , cawagub jateng yang disiapkan golkar
1	3x kali kita ditelpon untuk proses mengikuti naik klaim nya , dan tinggal 18 / 05 / 2017 info akan ditransfer penggantian nya
0	soto kudus yang enak rasanya , walaupun cuma kaki lima . harga sangat terjangkau kantong . pendamping nya macam macam : sayap ayam , perkedel , telor muda , usus ayam goreng , pokok nya mantap . kalau datang setelah jam tujuh pagi sebelum jam 7 soto belum siap gelar dagangan tapi jangan lewat jam 10 pagi sudah habis
2	tidak rindu
1	saya sudah kirim email complaint karena telepon tidak masuk terus .
0	semua enak . mi abu-abu , mi black , tahu cocol dan sayap ayam nya mantap . buat makan camilan bisa di sini .
0	saya datang ke sini pas hari libur , sungguh kesalahan besar . jalanan menuju tempat ini macet nya luar biasa , setelah sampai di sini antrean untuk mendapat meja sangat panjang . tapi menurut saya ini malah membuktikan kampung daun begitu favorit sehingga kita rela berkorban datang kemari . makanan nya menurut saya enak-enak sih , harga nya juga tidak terlalu mahal . suasana nya yang sangat menyenangkan . hawa nya yang dingin .
0	restoran yang sangat unik dan memiliki citarasa nya sendiri . anda dapat merasakan seperti benar-benar makan di tengah sawah dan pelayanan yang dimiliki oleh restoran ini juga sangat baik dan ramah . terletak di tengah kota bandung , anda akan merasa seperti berada di tempat yang berbeda . sangat direkomendasikan untuk anda yang ingin suasana berbeda .
1	wasekjen pan menyatakan pertemuan tersebut untuk membahas persoalan bangsa dan penjajakan koalisi di pilpres 2019 .
0	tempat makan yang agak nyempil tapi sangat layak untuk dicoba . ada di lereng bukit dan satu lagi yang saya ingat yaitu ada pohon besarr dan tinggi yang dihiasi dengan lampu . makanan memang mahal standar 200 ribu tapi bukan makanan asal-asalan . dihias dengan cantik dan rasanya juga enak .
0	restoran raja sunda . makanan nya oke enaklah . kami sekeluarga pesan ayam goreng . gurame goreng dan usang galah bakar .
0	ini merupakan salah satu mi legendaris di bandung dan temap nya tidak banyak mengalami perubahan sampai saat ini , dengan bangunan tua seperti rumah biasa . saya suka mi yamin asin , mie nya lembut dan sepertinya home membuat . kuah kaldu nya gurih .
0	tidak menyesal beli makan di warung upnormal . masakan nya enak-enak . cara mereka mengolah indomie juga beda , jadi lebih enak gitu .
0	makan malam romantis bisa di sini . eksklusif . ada space di luar dengan menu yang premium . ada di daerah perbukitan
0	. bagi kita yang rutin penuh kesibukan . ada saat nya menikmati suasana yang nyaman , damai , dan tenang . salah satu upaya mengobati rasa tersebut . adalah menyegarkan sambil menikmati makan siang di kawasan rumah makan sapu lidi . serasa kita berada di tengah sawah , suasana perdesaan , sejuk , wuaahh nikmat deh . meski jarak dari pusat kota bandung , agak jauh . tak ada ungkapan yang lebih indah . selain . silakan anda berkunjung ke rm . sapu lidi .
2	eggy sampo menawarkan perpaduan fusilli dengan udang dan telur asin . meskipun mbak nya menyatakan bahwa porsi large = 2 porsi mi , porsi lage nya terasa kurang enak . green tea bule nya tidak terekomendasi , selain harga nya mahal , rasanya biasa saja dan bule nya sedikit sekali , mending beli obrolan me deh
0	ayam karmila menyajikan menu masakan khas indonesia . saya memesan menu ayam goreng gurih nasi merah dengan sambal tomat . rasa ayam nya benar-benar enak gurih dengan sambal tomat yang menggugah selera . sambal bawang nya juga terasa segar . jengkol balado ! menu ini yang jarang dijual di tempat makan hits , meskipun overpriced untuk menu jengkol , saya sarankan untuk memesan menu ini nasi tentunya :
1	mandagri sebut jumlah anggota tgupp , anies baswedan senyum-senyum via
0	selama ini kalau mendengar berapa permai alias maison bogerijen , yang terlintas di dalam benak adalah makanan yang harga nya harus merogoh kocek dalam-dalam , karena berapa permai sudah ada sejak zaman hindia - belanda . tapi atas saran seorang teman untuk kertemuan di sana dan mencicipi beberapa menu nya , ternyata asalkan kita bisa memilih nya , kita tidak harus habiskan uang sampai rp 100.000 untuk menikmati hidangan enak .
2	bangsat nih biksu kata nya agama damai . itulah kalau minoritas berkuasa ? beda dengan islam yang rahmatan lil alamin . mudah-mudahan azab allah segera turun di myanmar . khusus nya terhadap terorist
1	harapan kami anda sebagai pemimpin negeri ini . kekayaan yang kita miliki . akan kembali kepada rakyat , rakyat hidup makmur , nkri harga mati . kita rebut kembali kekayaan negeri ini yang telah jadi bancakan para penghianat dan penjual aset bangsa . bravo bung prabowo . insyaallah
0	bisa pesan ayam kuning dibakar , sambal dadak tanpa gula buat yang tidak suka manis . selalu ada jengkol . lalap nya pun segar .
2	mahasiswa bodoh jadi badut politik . kalau berani acungkan kartu merah ke dpr yang tidak ada kerja dan hasil nya buat rakyat .
0	saya sangat suka dengan ayam kampung nya dan yang paling bikin saya ketagihan adalah sambal bawang nya . buih . tidak ada dua nya .
0	dari mulai lobi disambut dengan ramah oleh staff hotel , sampai di restoran pun ramah sekali sambutan nya sampai-sampai mreka menjelaskan menu satu per satu . acara birthday anak saya dan warga pun menjadi menyenangkan dengan makanan yang enak dan tempat bgtu nyaman
1	jual ikea tolsby bingkai untuk 2 gambar bingkai photo bingkai foto - magis Jakarta tokopedia lewat
0	saya suka makan di sini kalau ke bandung . makan dengan piring dari daun pisang yang tidak biasa . perlu dicoba ayam dalam bambu . tapi yang saya sesalkan kenapa mereka menjual ikan hiu ? saya sedih sekali melihat ada babi hiu yang dipajang di antara ikan-ikan lain di lemari pendingin .
0	tempat makan nya indah dengan berbagai menu yang menarik . masing-masing tamu dan grup mendapatkan saung tersendiri dengan bantalan seperti kasur serta cushion pillow yang nyaman . heheheh . bisa numpang tidur siang karena tempat nya benar benar nyaman . makanan lumayan enak , porsi cukup besar .
0	enak sih tetapi berlemak sekali karena ada sum-sum nya . saya memesan yang porsi 1 / 2 harga nya lumayan juga sih . kaldu nya berasa banget . kikil juga lembut lumer di mulut .
0	pemandangan sekeliling kebun teh sangat menawan . tidak pernah saya temui di kalimantan . suasana yang sejuk dan tenang menambahkan kesan aman dan tentram di sana . warga nya juga ramah . cocok untuk anda ku njungi saat berada di ciwidey
0	terima kasih banyak noona , aku puas banget sama post it dan signed pagi nya ? noona begitu baik dan ramah kepada aku walaupun kita tak saling mengenal , dan membantu ku jika aku kesulitan .
0	bakso tahu dan siomay favorit kami sekeluarga . harga terjangkau dan rasa yang enak . khas bandung . layak dicoba untuk para turis :
0	saya tidak kecewa dengan jokowi
0	setelah kalap belanja di cihampelas , kami memutuskan untuk makan di warung tenda pinggir jalan . dalam perjalanan pulang ke hotel , kita lewat jalan kecil untuk menghindari macet . dan . bertemu warteg ini . pas datang ramai banget ! kita mesti antre sebentar . kami pesan nasi uduk ayam bakar madu usus kol goreng . rasanya enak ! nasi uduk nya standart , tapi ayam bakar madu nya parah bikin ketagihan banget !
0	kalau mampir ke bandung , jangan lupa nyicip bubur ayam hamid . asli , enak banget , beda dengan bubur ayam di tempat lain . suiran ayam nya lumayan banyak , bumbu nya juga terasa banget , apalagi jika kita makan nya ditambah sate ampela atau usus . dijamin bakal ketagihan !
2	negara khilafah tidak boleh ada perbedaan , semua harus salat . kita bunuh dulu mereka sebelum kita dibunuh
1	dia memakan susu indomilk di dalam kulkas
2	bagi yang paham konstelasi politik suksesi nasional di luar soal sipil atau militer adalah juga soal jawa dan di luar jawa bukan rasis tapi ini sudah menjadi patron kekinian presiden orang jawa , wapres nya dari luar jawa jadi soal jokowi - ahy atau jokowi - prabowo adalah nonsense
0	pakai liptint tony moly enak parah
0	kalau anda ingin suasa romantis buat makan malam di bandung bersama orang terkasih atau berkumpul dengan kawan atau keluarga , the valleylah tempat nya . restoran ini terletak di dataran yang terbilang tinggi di bandung , jadi kalian bisa makan malam sambil menikmati indah nya kota . karena dari sini kita bisa melihat kota bandung dengan kerlip-kerlip lampu nya yang menawan . makanan nya enak meski terbilang mahal . tapi itu tidak masalah .
0	walaupun di bandung sudah banyak mi-mi lain yang punya nama . jangan lupa coba mi avon ini . tempat nya memang sempit dan kalau waktu makan siang susah dapat sport aprkir , tapi rasa dan porsi nya tidak mengecewakan . rasanya dari dulu menurut orang tua sampai sekarang tidak berubah .
0	bakmoy banget . kalau minggu pagi pasti antre . nasi lengko juga enak . harus dicoba murah meriah kalau ke bandung harus coba .
1	kapal km fungka permata v terbakar , sedikitnya 13 tewas
2	perjalanan malam ini sungguh melelahkan di daerah perumahan silandak
2	owi lagi ketakutan tuyul nya jadi terntayangan haha
0	salah satu hidden gem di bandung , restoran steak rumahan yang menjual steak berkualitas dengan harga yang cukup terjangkau , walaupun seperti di rumah namun tempat nya cukup luas , pelayanan nya juga baik dan produk yang dijual juga bervariasi .
2	tinggalkanlah kalau kamu memang sudah bosan sama pacar mu dan pacaran tidak ada guna nya buat kamu .
0	tempat ini asik banget buat berkumpul . suasana nya enak dan tidak bising . untuk minuman kebanyakan enak enak . kalau makanan yang harus dicoba adalah steak nya . rasanya dua jempol
0	ke sini malam hari sama teman-teman bagus banget pemandangan - nya . romantis banget kalau makan nya di balkon luar . top deh .
0	pemandangan yang bagus , cocok untuk melepas stres dan penat setelah hari hari aktifitas di kantor . datang bersama istri untuk honeymoon dan dikasih kue komplemen . suasana pada saat afternoon tea sangat mantap . terima kasih kepada mbak dian for servis nya
0	tempat nya di lantai paling atas dari mal riau junction . aneka makanan cukup banyak tersedia sehingga pengunjung di pusat perbelanjaan milik grup yogja ini bisa memilih sesuai selera . untuk harga dan juga pelayanan standar saja . hanya kalau diperhatikan sejak buka pertama dulu baik desain atau penataan ruang , menu yang ada kebanyakan menu-menu nusantara tidak banyak yang berubah .
0	indonesia dan jiwa-jiwa penduduk nya yang bangga . bravo garin ! sinematografi nya mantap . musical score nya keren .
0	penasaran dengan firewings yang digadang-gadang pedas nya mantap akhirnya kami mampir ke richeese . pesan paket untuk berdua , si aa kecil yang tidak doyan pedas jadi pesan yang biasa saja . pas dimakan memang mantap . pedas nya nampol , tetapi saat dicocol dengan saos keju ada sensasi beda . lumer panas di mulut . poko nya harus coba deh !
0	suka dengan tempat ini . bayar masuk hanya 20 ribu saja . tetapi makanan di dalam cukup mahal . tetapi ya nama nya juga tempat wisata sepadanlah . unik nya uang ditukar di kasir dengan voucher uang2an hehe . tetapi jangan tukar banyak banyak dulu ya . soal nya uang yang sudah dibeli tidak bisa diganti sama uang lagi __laugh__ . tempat spot foto banyak .
0	restoran dan juga penginapan ini bernuansa seperti pedesaan . suasana nya yang asri membuat kita merasa seperti berada di sebuah desa . tempat yang cocok untuk mengajak keluarga berlibur . makanan ala tradisional yang nikmat juga bisa kita santap di sini .
0	sayang
1	saya bertemu dengan nya di eat boss
0	rumah makan ini sudah bertahan puluhan tahun , dan selalu ramai di waktu makan siang . bakmoy sup tahu dan potongan daging babi dan babi sayur asin menjadi favorit di sini . selain itu juga ada lotek , gado-gado , macam-macam rujak , dan nasi rames . rasa makanan nya sangat oke dan tidak berubah dari zaman dulu :
0	lokasi nya di daerah wisata bunga cihideung , dari arah bandung anda harus belok kiri masuk ke jalan . sersan bajuri dari sana tinggal ikuti jalan raya besar melewati wisata bunga cihideung , anda akan dimanjakan dengan koleksi tanaman hias sepanjang jalan menuju sapu lidi , akses masuk ke sapu lidi harus masuk dulu ke kompleks perumahan graha puspa .
0	paling suka beli kue di sini buat ulang tahun atau sengaja memanjakan lidah di sini tempat nya the harvest , aku sering beli di buahbatu kebetulan tidak terlalu jauh dari rumah , cabe nya enak-enak anak aku paling suka kue chocolate aku suka yang segar-segar yang aroma buah stroberi , mangga , yang pasti semua kue di sini enak-enak puas deh menikmati nya bikin ketagihan ini lidah .
2	bosan . harga mahal pelayanan lama .
2	aduh hitam sekalilah seperti orang negro juga atau papua .
2	pakai indosat bukan pelayanan , pakai telkomsel strip 1 , ingin marah : tolong ini masih di pulau jawa lo
0	paling suka makan ayam bakar bumbu bali , sambal nya mantap , tempat nya cocok buat kumpul bareng keluarga
2	film ftv itu tidak bagus film nya mengajarkan orang selingkuh !
2	kasihan lu parit parit di jakarta sudah mulai di tutup oleh gubernur rasa presiden ya
0	ayam goreng suharti dari dulu memang enak sekali , saya dan keluarga setiap ke bandung pasti ke tempat ini . karena ayam nya enak lunak dan garing . di sini juga tersedia bermacam-macam menu ada gudeg bacem dll.
2	bosan sekali duduk di bangku hijau iniii
0	enak pizza nya , bir nya juga banyak varian , yang jarang ditemui ada di sana , enak buat santai-santai sama teman , berdua sama pacar juga enak . hehe
0	sangat enak tempat nya , mungkin bisa untuk nongkrong dengan biaya mahal atau makan malam keluarga . tempat ini menyediakan steak dan makanan barat . berada di dago pakar anda bisa melihat keindahan kota bandung dari sini .
0	sambil menunggu pesanan martabak andir yang harus menunggu 2 jam , saya ke sini untuk sekadar nongkrong . varian makanan nya benar-benar banyak . harga nya masih relatif murah , sekitar 15 ribu an untuk per porsi nya . harus dicoba serabi nya , enak dan adonan nya lembut .
0	sekilas mengenai raja sunda : restoran khas sunda yang berpusat di jalan terusan pasteur . tapi kebetulan kita sekeluarga mengunjungi cabang yang berada di jalan trunojoyo . cabang yang bahkan tidak tertera di website resmi rajasunda.com hal yang saya sukai : - pelayanan ramah . mulai dari mamang parkir sampai dengan staf resto .
0	chiba steak dekat kantor saya . pelayanan sih oke . rasa biasa saja . tidak ada yang spesial dari steak yang disajikan . semoga bisa maju terus chiba steak .
0	__laugh__ aku suka banget sama indomie yang dimasak dengan cara khusus di kantin nya itu apa nama nya lupa .
2	indihome memang tidak beres , bayar mahal tetapi fasilitas 0
