0	alhamdulillah . kita masih bisa merasakan daun pisang yang segar dan alami di tengah kota ini . diantara hiruk pikuk kendaraan dan beberapa penganan yang tidak terlalu membangkitkan selera , restoran ini menawarkan cara makan sederhana dan mengedepankan tradisi . seperti lagi piknik . makan dengan berbagai pilihan sambal dan lalapan . nikmat nya dengan tangan .
0	suasana di sini sangat nyaman dan dingin ditambah espresso dan hot chocholate nya mantap menemani malam yang dingin . pelayanan yang diberikan oleh mbak delayg baik serasa mengobrol dengan teman sendiri . sangat rekomendasi .
2	kasihan , padahal kalau tidak ada polling denny siregar cebong girang sekali . sayang , dipupus oleh kalah telak nya jokowi di polling denny . hahah
0	rasa dan aroman nya luar biasa . kuah bening , segar tidak berlemak dan tidak berminyak . hati hati tidak kebagian tempat dusuk jika jam makan siang tiba . bagus rasa !
0	di bakerokan saya sengaja mencoba macarons dan kue nya . ternyata rasanya lumayan enak mempunyai cita rasa kue di kafe-kafe pada umum nya tetapi macarons nya enak sekali karena tidak terlalu manis .
1	anggota dpr ri : warga yang kosongkan kolom agama di ktp sama saja dengan komunis -
2	jemput paksa aja ! takut banget sama rizieq . kalau api menghalangi bubarkan sekalian .
2	mccf singkatan dari mulia cirebon orang cina makanan . kantin ini menyediakan chinese food yang disimplifikasi . fitur utama nya rasa yang lumayan dan porsi besar , cocok untuk pangsa pasar mahasiswa yang menjadi target market nya . saya pribadi kurang suka .
0	terima kasih untuk notice nya , maafkan karena telat untuk memberi tahu , tetapi pelayanan pelanggan representative , indosat sudah membantu menyelesaikan masalah saya saat itu juga . selalu maintain kamu hardwork .
2	kata nya menolak bantuan pemerintah dan mau berangkat dengan uang sendiri , sementara donasi sudah terkumpul 200 jutaan kok malah tidak ikutan sih ? apa itu hanya pencitraan ?
2	bakmi tasik saya dan beberapa teman mampir dan coba bakmi bakso nya . makanan nya biasa-biasa saja . tidak ada yang special .
0	lokasi kafe ini di bandung atas dago dengan lokasi yang cukup unik , yaitu bangunan yang menuruni tebing dan di tengah tengah rimbunan pohon . dengan lokasi di atas perbukitan , maka pengunjung dapat menikmati pemandangan dan udara yang cukup bagus . resto dan kafe ini menyediakan makanan indonesia dengan berbagai variasi . secara umum penyajian dan rasa makanan nya biasa saja dan pada kondisi . lanjutan
0	kopi progo menyajikan aneka kopi mulai dari classic espresso sampai dengan kopi latte . rasa kopi cukup enak , rata-rata rasa kopi kafe biasa , tidak ada yang istimewa dari rasa kopi yang disajikan . di sini juga ditawarkan makanan ringan menemani santai saat minum kopi . tempat nya cukup unik dengan live musik dan cenderung ramai saat malam hari .
2	benci banget sama ibu-ibu hamil yang tiba-tiba datang minta duduk . ya gua tahu lo hamil tapi tolong dong berangkat pagi . ke stasiun yang jauh sekalian biar dapat duduk gua saja tidak hamil bela - belain berangkat pagi demi dapat tempat duduk . dasar memang tidak mau susah . menyusahkan orang .
0	pertama kalinya datang ke resto ini suasana nya adem . romantis buat yang berpasangan hehe . ke sini sekeluarga setelah acara wisuda suami . daftar tunggu nih jadi harus menunggu rada lama . dapat meja yang berada di lantai 2 . di dinding nya banyak terpajang lukisan cantik . kami pesan menu cukup beragam , semuanya enak , porsi besar alhasil sungguh mengenyangkan . my babi antusias sekali makan nya lahap .
0	sukses
2	semoga kabut asap yang ada di riau semakin pekat sehingga orang islam di riau mati semua karena kehabisan oksigen dan mengurangi populasi islam di dunia .
0	suasana kafe nyaman untuk bersama pasangan . kafe ini juga menyediakan tempat bermain untuk anak-anak . makanan yang disediakan banyak variasi nya dan enak .
0	kami mengunjungi tempat ini saat menginap di salah satu hotel di bandung , lokasi ramen cemen di daerah cihampelas , saat itu saya beef spicy ramen dan ice lemon tea , rasanya enak dan harga nya pun cukup terjangkau .
2	mencoba untuk buka puasa di 18th . dengan harga yang tergolong mahal di antara hotel berbintang di bandung , rasa yang ditawarkan sangat mengecewakan . pasta nya hambar , bebek makanan lain juga hambar . sangat berbeda dengan apa yang biasa ditawarkan . dan pelayanan juga kurang profesional pada saat melakukan pembayaran dengan mengunakan kartu kredit bank mega .
2	tumben waras nih ustaz gila dan sesat
0	di mah seniman kita bisa bersantap sambil menikmati nuansa sunda . tempat ini cocok bagi wisatawan yang berkunjung ke bandung .
0	jiganasuki merupakan restoran jepang yang menawarkan menu makan sepuas nya . paling baik ke tempat makan ini jika ada promo , sehingga hemat di kantong : secara keseluruhan baik enak , - wagyu refill sepuas nya - suki nya biasa saja , encer - ocha nya enak , - pudding dan es krim nya enak
2	tidak menyalahkan net kok , kebanyakan exol hanya kecewa saja sama dengan . kan ego sudah lama banget enggak cb jadi nya kecewa nya sekecewa ini . mana exol banyak dapat kabar juga bahwa exo sudah bikin mv dan masih banyak kode yang lain dan exol mengambil patokan di linimasa itu jadi nya kaget aja pas .
0	ini ketiga kalinya saya pesan burger disini . rasanya tidak ada yang mengalahkan deh . enak banget . pelayanan cepat . harga terjangkau .
0	butuh perjuangan untuk menuju ke lawang wangi , jalan nya berkelok-berkelok dan menanjak . kiri kanan jalan pemandangan nya lumayan bagus . awal nya saya sangat penasaran untuk berkunjung ke lawang wangi tapi ternyata biasa saja . makanan dan minuman nya harga yang cukup mahal tapi rasanya standar . pelayanan nya memuaskan . setiap malam minggu ada live musik . saya sarankan berkunjung di siang hari agar bisa melihat pemandangan luar .
0	tidak disengaja kami mampir makan sore di karmila , ternyata harga nya murah ! masakan nya enak , saya dan keluarga suka . sambal juara nya enak banget . rekomendasi sekali , yang kami pesan tidak ada yang mengecewakan . kalau di jakarta persis dengan ss spesial sambal tapi karmila versi porsi lebih besar . suka sekali , bulan depan saya ke bandung lagi , pasti saya akan . lanjutan
1	setiap sudut kota jogja itu romantis , kata anies baswedan .
0	tidak ada yang istimewa dengan kafe ini . pesanan saya waktu itu 2 es kopi dan kentang goreng . kopi nya terlalu manis . parkir luas
0	jalan braga salah satu jalan yang cukup terkenal di kota bandung . ada banyak tempat nongkrong untuk makan , minum atau sekadar nongkrong bersama teman atau keluarga . boleh dicoba resto ini dengan nama cukup unik braga punya cerita . interior mengambil konsep tempo dulu . menu cukup beragam dari makanan indonesia maupun barat , rasanya biasa saja tetapi untuk minuman okelah . untuk harga masuk menengah .
0	cepat respon , pengiriman super kecepatan . barang sesuai deskripsi . terima kasih doki toko
0	tempat nya bagus tapi sayang toilet nya kurang memadai , lokasi strategis harga tiket masuk pun murah dan tiket masuk bisa ditukarkan dengan aqua atau bibit tanaman
2	begitu detail nya dulu dan sekarang dia membohongi rakyat . ketika kampanye semua topeng kesederhanaan ditampilkan .
0	saya kemarin sarapan di sini , tempat nya asik karena menghadap di luar , selalu suka dengan sandwich toast nya dan minuman milk teh nya .
0	makanan enak , pizza dan spaghetti bolognaise nya juara . minuman bisa pilih kopi , soda atau aneka jenis lain . lagi senang pilih big kotak - nya . lokasi nya strategis .
2	pelaksanaan tes skd apa terlalu dipaksakan minimal ? kok banyak yang ditunda gara-gara jaringan komputer . kasihan yang jauh-jauh datang ke lokasi ujian euy , buang tenaga , waktu , dan pasti nya merubah psikologi juga :
2	saran aku jangan beli makan di rumah makan jasa baru selain harga mahal , pelayanan tidak sesuai dengan harga makanan nya .
1	digemparkan lagi dengan meletus nya kasus saracagub etnis cina ahok usungan pdi - apa nyaris melunturkan nama jokowi dan megawati
2	inilah sebab nya semua partai koalisi meninggalkan gerindra . semua gara-gara fadli zon dan kawan-kawan .
0	rasanya hampir sama dengan resto yang lain di bandung yang jualan seafood . aman bersih dan pelayanan nya cepat .
0	restoran ini merupakan alternatif tujuan wisata kuliner di bandung yang sangat berbeda dari kebanyakan restoran lainnya . kita dapat menikmati hidangan khas sunda dan masakan indonesia umum nya dengan cita rasa yang enak dan pemandangan alam yang luar biasa , seperti bukit , sungai , dan pohon yang rindang . kampung daun didesain seperti desa yang terletak di tengah lembah dialiri oleh beberapa sungai .
0	habis belanja bareng teman langsung kita buka di sini menu pilihan nya banyak tempat nya luas lagi jadi kita pulang shoping dengan perut yang kenyang , enak enak makanan nya juga .
0	ini suki and barbeque versi murah meriah . lumayan banget , harga nya tidak begitu mahal tapi kita cukup puas . pilihan menu nya lumayan banyak . kita makan sampai kenyang banget juga paling cuma 100 ribuan untuk berdua .
1	salah satu kantor djarum berada di jalan dari . otten no. 10 , bandung
0	asyik nya di pizza hut ini adalah terdapat menu basic yang harga nya sangat ramah di kantong , paket basic berdua 70.000 saja tapi kenyang .
2	apa pun yang jokowi lakukan , saya tidak akan terpikat . sekalipun dia membangun jalan tol atau memperbaiki infrastruktur indonesia , itu tidak bernilai apa-apa di mata saya .
0	roti bakar tunggal beda dengan roti bakar biasa . roti nya tebal , dengan olesan butter , dan pilihan rasa yang banyak kopi , keju , strawberi , kacang , dan lain-lain . isian dalam nya cukup banyak , tetapi tidak membuat rasa roti bakar nya tertutup . roti bakar tunggal mempunyai beberapa outlet selain outlet utama nya di jalan . jend . sudirman .
2	egois
2	saya mengetahui restoran ini dari ulasan-ulasan yang saya lihat di internet dan akhirnya saya tertarik untuk mencoba karena diiring - imingi oleh rasa yang enak dan harga yang terjangkau . saya dan keluarga mencoba datang dan sebagian besar memesan menu sirloin ala suis dan tenderloin , dan ada satu yang memesan pork chop . secara keseluruhan baik kami kurang puas dengan steak yang disajikan , daging nya terlalu tipis . harga terlalu mahal juga untuk ukuran steak yang seperti itu .
0	restoran terbaik di bandung dengan semua pilihan makanan nya yang enak dan selalu sempurna , harga yang sangat terjangkau , pelayanan yang selalu memuaskan , dan suasana yang nyaman . setiap kali mengunjungi bandung pasti akan kembali dan makan di sini paling tidak sekali . terus dijaga !
2	makan nya lumayan , tapi ada pelayan yang agak jorok saja jadi kurang nyaman . untuk makanan agak cepat ya agar tidak kelaparan konsumen . masih banyak yang harus ditingkatkan .
2	sampai kapan pun saya tidak akan memilih orang pengecut seperti prabowo . menurut saya , dia tidak pantas memimpin negara .
2	islam anjing babi bangsat mati saja itu islam babi ?
0	saya ke sini karena mendapat rekomendasi dari teman-teman . kebetulan restoran ini terletak persis di sebrang tempat saya menginap . karena saya sudah makan siang , saya putuskan untuk memesan dessert saja . saya pesan pannacotta , volcano , souffle , chocolate mousse , dan creme brulee . awal nya saya tidak berekspektasi tinggi terhadap hidangan ini . namun setelah mencoba . luar biasa enak ! harga nya pun murah ! sangat dianjurkan !:
1	untuk pengecekan layanan mandiri verified by visa vbv tidak dapat melalui layanan mandiri call 14000 , namun hanya bisa melalui email dan kantor cabang bank mandiri .
2	mahal
0	setelah sekian lama tidak berkunjung akhirnya mencoba lagi makanan di sini , dengan banyak menu baru seperti bebek petasan yang pedas nya garang ! dan minuman tradisional yang segar sekali ! direkomendasikan untuk selalu makan di sini !
0	suka banget sama ramen dan baru kali ini menemukan ramen yang rasanya enak banget dan tidak murahan , meskipun harga nya di bawah harga normal . tempat nya luas , unik , enak buat nongkrong sambil ngobrol-ngobrol bareng teman , tempat nya cukup bersih dan pelayanan nya ramah . menu makanan di sini menyediakan bukan hanya ramen saja , tetapi ada menu makanan jepang lainnya .
0	hiu , kali ini gue kasih 2 jempol buat restoran ini . enak banget iga nya . gue sudah dicoba iga yang balado dan ada lagi 1 jenis iga gue lupa nama nya , warna bumbu nya hijau pokok nya ini juga manteb setelah . tidak menyesal deh ke sini . untuk harga nya standar lahya untuk kelas menu kayak iga begitu hehe
0	hebat
2	jangan percaya . di Jakarta saja orang ini tidak bertanggung jawab cukup warga Jakarta yang menjadi korban
0	mulai dari suasana , dekorasi saung , ragam rasa makanan semuanya oke . suasana nya khas pedesaan yang sunda banget , makanan yang enak , di saung nya bisa lesehan sambil tiduran , karena disediakan juga beberapa bantal buat istirahat . makan sambil lesehan sambil mendengar gemericik air yang mengalir di sungai kecil dekat sana rasanya enak . kalau malam suasana nya lebih romantis lagi .
0	tempat nya seperti food court dengan banyak pilihan menu makanan di dalam nya . tentu yang paling terkenal adalah batagor nya . dan memang rasa batagor nya cukup enak dengan porsi yang tidak terlalu besar . di dalam menu mereka menulis untuk 1 porsi batagor isi nya 2 , namun setelah disajikan ternyata porsi nya tidak terlalu kecil , cukup untuk seorang karena batagor nya cukup besar . selain itu mereka juga menawarkan cendol yang sangat segar .
0	gizi termasuk restoran dan kafe yang punya gaya tersendiri , tempat ini menjadi ajang panggung bagi pemusik kafe , tempat ini tidak terlalu ramai , suasana nya juga tenang . waktu tahun 80 an . tiap malam ada live musik . masakan nya juga enak ,
0	lotek kalipah apo 42 merupakan salah satu penjual lotek yang paling nikmat dan legendaris di kota bandung . lotek adalah makanan khas indonesia yang terdiri dari berbagai macam sayuran , diantara nya bayam , kangkung , tauge , nangka muda dan sayuran lainnya yang diaduk dengan saus kacang kental . saus kacang kental biasanya diracik langsung dengan cara diulek dengan bahan lainnya yaitu garam , gula merah , air , cabai rawit dan kencur .
0	saya dan keluarga mampir makan di saung pengkolan 2 . kami memesan ayam bakar , cumi goreng tepung , paru goreng , babat goreng , karedok dan untuk minum memesan soda gembira dan teh manis . saya pikir dengan harga yang tertera pada menu irisan / potongan babat dan paru berukuran sedang , namun ternyata kecil sehingga saya memesan untuk lagi agar bisa menghabiskan nasi . porsi cumi goreng tepung . lanjutan
2	kesal
2	para cebong yang selama ini menuduh saya mencuri uang sedekah 30 %, silakan anda urus si aris wahyudi ini . dia ambil komisi 20 % untuk transaksi pelacuran berkedok agama . berani tidak , membulat si aris wahyudi ini ? atau kamu semua cuma berani sama jonru ?
0	sate kambing m . hadori ini cukup terkenal di bandung . apabila tidak bisa mengunjungi lokasi di pusat nya . anda bisa juga menemukan sate kambing m . hadori di beberapa tempat makan seperti paskal hypersquare dan the kiosk .
2	makanan oke sama seperti xo suki lainnya . tetapi walaupun hari libur besar seperti lebaran ini bukan berarti senyum nya libur dan order minum , dan lain-lain harus order berkali-kali . tolong di jaga kepuasan pelanggan nya . terima kasih .
0	nasi goreng bistik aa dengan rasanya yang nikmat banget . buat kamu pecinta nasi goreng . ini layak dicoba , rasanya bikin ketagihan dan ketagihan lagi . waktu pesan juga banyak yang mengantre , memang top ini nasi goreng . apa lagi dekat rumah saya jadi saya bisa tiap hari coba nasi goreng ini . nikmat banget deh !
0	warung steak baru yang saya rekomendasikan di bandung , ingat ini warung steak bukan fine dining atau bistro , manage your expectation . terletak di sebuah sudut di perempatan cicendo - pajajaran berseberangan dengan pabrik kina pt . kimia farma . harga makanan minuman cukup merakyat < 20$ / keluarga 4 orang , kualitas , pelayanan , porsi oke . menu cukup bervariasi dari yang terbarat - baratan sampai ke timur-timuran :, tersedia ruang . lanjutan
0	saya suka sekali tempat ini . jawara banget . lokasi nya di tebing jadi bertingkat tingkat . paling suka yang agak turun . sebelah kanan . luas . nyaman . makanan nya juga enak enak . nasi liwet nya enak . gepuk nya enak . seluruh keluarga sangat menikmati kalau diajak ke sini . harga nya tidak bikin dompet bobol .
0	contohlah suporter jepang saat menonton pertandingan piala dunia yang dengan sangat rajin membersihkan sampah seusai menonton pertandingan
2	muka nya saja sudah kayak iblis , hukum mati saja anak itu .
0	coffe miening glory di setra - sari bandung utara . cogfe nya wangi dan tempat di tata bagus banyak pepohonan , di depan ruko kecil tersedia 2 meja saja . tapi masuk ke dalam taman cukup besar . dan santai . enak .
2	sebenarnya harga nya baik mengikuti style kafe nya ya . dibangun dengan bagus dan instagrammable . sayang nya , saking ramai nya pelayanan nya tidak memuaskan . tidak cekatan dan makanan yang disajikan juga tidak istimewa bahkan tidak ada rasanya . truly , not rekomendasi , untung pemandangan nya bagus .
0	suka banget belanja di di lazada
2	suasana nya bagus alami seperti di desa banget pinggir hutan . kami coba nasi goreng kampung , ayam kahaseupan ayam asap , jamur bakar , sayur-sayuran . nasi goreng dengan ebi kering cukup enak . ayam nya bau asap cair banget jadi kurang disukai . jamur bakar oke . cah kangkung porsi nya agak sedikit . harga sedikit di atas rata-rata , misal ayam kahaseupan rp 95 ribu / ekor . anak-anak relatif kurang suka .
0	bakmi nya enak sekali . secara saya favorit mi . enak nih . terus ada cabang nya juga di jakarta , hanya memang tidak seenak yang asli nya di jalan naripan . oke deh ini mi .
0	kalau buat nongkrong atau sekadar minum kopi santai saja di daerah bandung warung salse harus dicoba , makanan nya lumayan murah dan cocok di lidah tempat nya juga bagus buat foto .
0	mi naripan adalah rumah makan dengan menu spesial mi yang sudah terkenal sejak dulu di bandung . menjadi tujuan favorit bagi para pelancong . rasanya yang lezat dan porsi nya yang memadai , membuat selalu mengunjungi nya bila ke bandung .
0	menyediakan berbagai macam masakan sunda yang disajikan tanpa piring . namun beralaskan daun pisang . soal rasa makanan lumayan enak .
0	sambal nya bikin ketagihan , rasa ayam nya tidak ada dua nya , pelayanan nya oke , lingkungan unik dan pas untuk bawa keluarga
2	apa cuma gue dong yang kalau dapat gojek motor vixion . terus kalau driver nya mengerem gue suka melorot melorot begitu . risi kan
2	setiap kali berkonfrontasi dengan kubu fpi , selalu mereka yang memaki dan merendahkan duluan karena imam besar nya saja demikian , tidak pantas ditiru .
2	lunox . beli sejak awal rilis , belum mencoba classic sudah langsung peringkat . jadi feed . menyesal banget beli
2	saya heran kenapa orang bilang enak makanan ini . yang kami rasa harga sangat tidak sesuai dengan rasa .
0	di cabang taman kopo indah , tidak diberikan lalapan . rasa ayam goreng biasa saja , tapi rasa ayam bakar nya enak , hanya saja bagi saya agak terlalu pedas padahal pesan yang sedang . ayam nya benar benar pakai ayam kampung , terasa beda nya . dan porsi nasi nya cukup besar . secara keseluruhan baik cukup puas
2	senin pagi memang selalu tidak bersahabat , mulai dari pakai jilbab berantakan , jalanan macet , transjakarta arah senayan ramai nya astaghfirullah , absen telat lewat jam 8 , gaikut doa pagi , mau closing akhir bulan .
0	rumah makan yang menyajikan berbagai jenis masakan yang lezat , terutama menu steak dan nasi vietnam nya sangat nikmat
0	untuk pilihan makana nya kurang , enak buat hang out minum kopi ngopi bareng teman . pemandangan bandung dan tempat nya asik
0	suasana enak buat kumpul-kumpul . makanan simpel mulai indomie dengan berbagai tambahan , nasi dengan berbagai topping , dessert buah yang segar . enak . judul makanan nya saja yang agak aneh-aneh . saya coba nasi tuna 25 ribuan yang berisi 2 potong tuna yang ditumis dengan irisan cabai , dan bawang , enak . terus makanan penutup es krim dengan setengah kaleng leci 33 ribuan , tak terlalu murah tapi setimpal .
2	halo j triliun saya mau tanya , kenapa butuh menunggu 24 jam untuk antar dari Jakarta - tar . pengantaran paket j triliun sekarang lambat ya . saya kecewa . tolong dipersingkat alur pengiriman nya .
2	makanan nya enak tapi tidak rekomendasi . rariweuh tidak puguh . sudah menunggu lama yang dipesan tidak ada .
2	lomba panjat pinang diajarkan belanda untuk menertawai pribumi . apa pendapat mu ?
2	ustad babi somad , mulut nya harus segera disumbat tai anjing , biar bacot berhenti menyebarkan ayat-ayat yang disesatkan .
0	rekomendasi banget . tempat nya romantis , makanan minuman nya enak . kami dilayani oleh waiter bernama dela , yang ramah banget dan profesional melayani kami sebagai tamu . kami merasa sangat puas berkunjung ke the 18 , rekomendasi banget deh :
0	batagor nya enak , bumbu nya pas . harga nya saja yang agak mahal hehe . cocok jadi oleh-oleh , bisa minta goreng setengah matang dulu atau tidak digoreng dulu .
2	yang satu pura-pura dekat dengan bapak presiden , jangan-jangan ada sesuatu . mungkin dia mau cari perhatian kali sama bapak nya .
0	saat saya ke sini saya sangat menyukai tempat ini , kita dapat memetik stroberi sendiri , selain kebun stroberi di sini juga menyediakan jus stroberi , bisa juga bermain permainan di luar di sini . menyenangkan .
2	internetan dengan menggunakan indosat saya anggap sebagai ajang pendewasaan diri , lemah otak banget woy parah !
0	tempat ini cukup terkenal di bandung . bagi kalian yang sedang mencari tempat jajanan murah di bandung , cuanki serayu bisa jadi pilihan . namun , bersiaplah untuk sabar menanti jika kalian datang pada jam makan siang , pulang kerja atau akhir pekan .
0	tempat berkumpul yang romantis . datanglah pada waktu malam hari , suhu yang dingin di keremangan malam menambah suasana romantis . kami selalu ke kampung daun jika liburan ke lembang .
0	steak nya tebal , matang merata , dan empuk sekali . harga nya pantas sesuai kualitas dan rasanya yang sangat nikmat . meski parkir susah dan antre > 20 menit untuk mendapat tempat duduk , kami pasti datang lagi untuk mencoba menu steak lainnya . agar suasana lebih nyaman , lebih baik datang lebih awal , sebelum jam sibuk time makan khusus nya malam minggu atau hari libur .
2	nah , tapi lebih kesal lagi sih kalau ada yang naik angkot tapi tas tidak dipang ku , sempit anjir
2	jutek banget deh karyawan indosat yang di graha indosat
2	kpk tidak berani usut kasus korupsi proyek reklamasi .
2	jadi . saya lapor dan penasaran png makan di sini . suasana nya oke , adem , meja dan kursi nya mengingatkan meja kursi waktu sampai dengan . pertama pesan berjalan mulus , suara mas-mas nya kecil sekali ampun deh tidak jelas bicara apa blubup blubup begitu haha saya memesan mi ayam 2baso ekstra , pacar saya memesan bakso urat soun . tidak lama datang pesanan pacar saya dan ternyata tidak sesuai ekspektasi .
0	kebaikan adalah satu-satunya investasi yang tidak pernah gagal .
2	selamatkan anggota kami . anggota pki adalah anggota paling suci sedangkan islam itu sesat .
0	restoran dengan desain yang bagus , pemandangan lereng yang menyejukan mata , ditambah dengan pelayanan yang sangat ramah dan menu menu makanan serta minuman yang beragam dengan rasa yang pas dan enak , baik makanan barat ataupun tradisional nya . satu poin tambahan bagi para guest yang menginap di padma hotel bandung .
2	sebagai pelanggan lama , kami kembali datang setelah sekian lama untuk menikmati steak yang yang terkenal murah meriah . seperti biasa saya pesan tenderloin favorit . tetapi banyak yang berubah selain harga juga ukuran steak yang kecil sekali dengan salad berupa wortel , jagung , dan kacang polong yang amat sedikit mungkin hanya sesendok makan , dengan pelayan yang sangat tidak tanggap dan tidak sopan . saya amat kecewa .
2	mereka sengaja hambat penyidik kpk sementara anak buah nya menghilangkan barang bukti .
2	orang papua bicara fakta lapangan . si jadit kampret omong doang sama si fadli zonkos .
2	ini tempat makan dan foto-foto , ada juga permainan anak . saya tidak makan di sini , kebetulan masih pagi pas ke sini jadi masih sepi . udara nya enak banget , sejuk . kalau tidak suka foto-foto ya tidak usah ke sini . 2 tiket bisa ditukar bibit tanaman . rata-rata tempat wisata di lembang , cuma jual tempat doang , makanan dan rasa biasa saja , harga mahal .
2	bagaimana bisa saya memilih jokowi lagi di tahun depan setelah selama ini saya merasa dia amat sangat tidak bertanggung jawab atas tugas nya sebagai presiden .
2	itu proyek trans papua digagas dan dimulai jaman sby . siapapun presiden selanjutnya itu trans papua akan terus dilanjutkan . dan dan diselesaikan oleh presiden periode-periode selanjutnya lagi . jadi cuma orang bodo tak bertepi kalau nga ku - nga ku itu prestasi satu presiden tok !
0	tempat ini sekarang buka di banyak cabang . selalu ramai dikunjungi anak muda . tempat hits - nya anak bandung . sebenarnya untuk menu nya biasa saja , hanya mi dan roti . tapi bisa jadi hits ya .
0	kafe resto yang terletak di dago giri ini memiliki konsep unik di dipadu padankan dengan gallery lukisan dan art sculpture lainnya . juga terdapat mini distro . untuk mengikuti tren buat kalangan muda , juga dibuat spot untuk berfoto ria dengan latar belakang pemandangan bandung dan gunung sekitar nya .
0	resto yang menawarkan galeri alami dan kafe serta memanjakan pengunjung untuk menikmati alam dan suasana pedesaan yang hening . penataan nya sangat unik dan mengesankan . resto menawarkan berbagai menu seperti nasi timbel , rawon , sop buntut , steak , pizza , pasta , gurame goreng , gurame bakar , nasi goreng dan sebagai nya . nasi timbel rasanya nikmat . gurame goreng rasanya renyah . rawon terasa segar dan mantap . makan di sini sangat romantis .
