0	salah satu dari sekian banyak restoran khas sunda yang rasa masaka nya enak , bervariasi , dengan tepat yang sangat sejut dan nyaman . sangat cocok untuk menu keluarga .
2	yang korupsi sampai triliunan dibiarkan begitu saja , sedangkan anak kecil cuma mencuri ayam sampai dipukul kepala .
0	dapoer pandan wangi punya menu-menu masakan sunda yang sangat rumahan , unik dan juga enak ! tapi kalau datang di hari minggu malam . pasti tidak dapat tempat . paling suka sup ikan kuah merah dan sambal jengkol . lezat !
0	untuk anda yang suka tempat nongkrong yang punya pemandangan alam , sierra dapat menjadi pillihan . makanan nya cukup enak dan pemandangan yang disajikan enak . cocok untuk tempat nongkrong bersama teman dan pasangan
0	kata-kata mb yenny sangat bijaksana . menjaga perasaan pak prabowo , namun mata hati yang jernih bisa melihat apa yang sebenarnya ada di dalam batin mb . saya sangat apresiasi sikap-sikap seperti ini . menyerukan . rendah hati .
2	tidak percaya sama sby , dia biang nya koruptor .
2	tidak kagum
2	jangan pilih jokowi di pilpres 2019 ! dia itu berpihak pada etnis cina !
0	masyarakat tidak kecewa jika dipimpin oleh jokowi lagi
0	setiap datang kebandung pasti saya selalu menyempatkan datang untuk sekadar makan malam di the valley . di sini memberikan kenyamanan tempat dan makanan yang enak dan beragam . cuku mahal , tapi terbayar dengan rasa yang saya dapatkan .
0	batagor adalah makanan khas dari kota bandung . batagor riri ini salah satu pelopor batagor terkenal di bandung . dulu masa jaya , saya nilai oke untuk rasanya . tapi semakin ke sini , bermunculan batagor batagor yang lain , jadi rasa batagor diri buat saya sudah tidak oke lagi . jadi biasa saja
0	sudah tiga kali ke sini , terakhir dengan teman-teman kantor , kesan nya alami dan sejuk . paling enak habis makan , santai di gazebo sambil tiduran mendengar gemericik air . ada teman dari luar kota yang kaget pas cuci tangan , air nya dingin banget , .
0	ini adalah resto yang menyajikan daging babi . penggemar mi pedas pasti ketagihan mi rica nya yang super aduhai pedas . yang tidak ingin pedas , bisa pesan mie lain seperti mi samcan . jangan lupa cicipi bakso udang goreng , langsung disajikan panas dan renyah .
0	tidak salah lagi ini kafe modern salah satu favorit warga bandung buat makan , berkumpul seriusan tempat nya nyaman soal nya .
0	mungkin kalau soal ayam goreng nya dan lauk pauk lainnya yang tersedia di sini sih biasa saja . tapi satu hal . kol goreng nya juara . pertama kali makan kol goreng di sini . rasanya ketagihan . meski tidak sehat . secara kol ketika di goreng bisa menjadi pemicu ... tapi ketagihan sodara-sodara .
0	makanan nya enak , suka banget sama nasi goreng dan ramen nya , didukung tempat yang nyaman buang nongkrong-nongkrong , ada fasilitas wifi nya juga , tempat makan yang lagi hits di bandung
2	saya tidak suka dengan prabowo yang selalu suka bohong
0	kalau restoran ini ada di pusat kota , mungkin tidak ramai kayak gini pemandangan nya enak di sini kalau makanan nya biasa saja dan lama pelayanan nya kalau tidak ada hujan balkon nya restoran cocok untuk makan malam romantis
0	yang spesial dari roti boy itu aroma dan rasanya , walaupun varian roti nya tidak banyak tapi roti nya punya ciri khas . aroma nya enak banget dan isian roti nya ada mentega atau apa gitu saya juga tidak tahu . untuk harga nya sekarang 10 ribu terakhir beli . cukup setimpallah untuk satu buah roti yang enak .
2	inilah contoh bek dengan sikap yang sangat buruk dari perilaku serta kinerja di lapangan .
0	waze sangat bermanfaat dan mudah digunakan
0	posisi restoran ini cukup oke . pemandangan kota bandung . suasana nya juga nyaman . romantis dengan lampu yang temaram . nyaman pokok nya deh , bersama pasangan , keluarga atau teman oke-oke saja . menu nya makanan barat untuk yang dekat hotel nya . untuk yang sundanese restoran nya terpisah agak di atas sedikit dari hotel . makanan nya untuk yang japanese dan makanan barat sih rasanya pas di lidah hanya sayang kalau mau makan di sini dompet harus sedikit tebal karena menu nya memang agak mahal , tapi untung nya terbayar .
0	kebanyakan restoran sunda di bandung memang memiiki kualitas makanan yang memuaskan , tapi di raja sunda ini pelayanan nya juga cepat tidak pakai lama . walaupun saat kami mengunjungi untuk makan malam menjelang waktu tutup restoran tapi pelayanan tetap ramah dan profesional . makanan cepat tersaji dan tentunya enak apalagi saat perut sedang lapar .
0	duh cah ganteng dan ethes . untung masih ada kamu yang bikin mata segar di tl .
0	rm makan sunda dengan konsep jadoel . memakai piring dan gelas dari kaleng . menu nya banyak dan rasanya lumayan . hari libur penuh susah parkir .
2	barang nya sudah sampai dengan selamat walau barang nya datang telat
2	saya tadinya penasaran dengan tempat ini karena di tempat nya banyak sekali foto-foto kunjungan para artis ke tempat ini tapi pas saya pesan makanan unggulan di tempat ini saya rasa tidak setinggi pemikiran saya yang ada biasa saja dan keras . jadi aneh bagi saya tempat ini bisa sebegitu terkenal nya
0	restoran yang tertinggi yang saya tahu di kota bandung . terletak di lantai paling atas dari hotel dan menawarkan pemandangan menakjubkan dari kota bandung peringatan , restoran ini tidak cocok bagi anda yang takut ketinggian . dengan harga yang pantas untuk restoran sekelas ini , saya memesan beberapa minuman dan makanan . meski agak sedikit lama , tetapi pemandangan sekitar membayar semuanya .
0	makanan enak , suasana yang dingin-dingin romantis pas banget kalau jalan dengan pasangan , pemandangan resto keren lebih pas kalau datang untuk makan malam
2	mencoba mencari alternatif lain bakmie yang belum pernah dicoba . kali ini mencoba bakmie anugrah . kami mencoba di area food court citylink fesv . dengan porsi sedang , harga sedikit mahal bila dibandingkan dengan rasanya yang biasa-biasa saja . , cenderung kurang enak , kuah nya pun kurang panas , dengan penyajian yang tidak menarik
0	bisa melihat bandung dari sini . pemandangan nya benar-benar juara . makanan nya jempol 4 tangan sama kaki , jadi enak dan so deliciosooo
0	penasaran kan the peak ? bagi para wisatawan khusus nya dalam negeri tidak usah bingung cari tempat berkumpul bersama keluarga dan pasangan anda di sini menyajikan menu yang bisa kita makan dan minum di mal , plaza , atau restoran lainnya yang bikin betah nih suasana nya khusus nya mulai jam 7.30 malam sampai jam 12 sangat luar biasa kita bisa lihat kota bandung .
2	saldo grab saya disedot oleh driver dengan memasukan biaya tol dan lainnya . padahal saya tidak ada melewati tempat parkir dan tol . mohon ditindaklanjuti . karena ini membuat saya tidak nyaman dengan aplikasi ini jika seperti ini terus .
1	kuis berhadiah ala anies : kepanjangan monas hingga nama wagub - anies baswedan mengadakan kuis berhadiah untuk warga di malam tahun baru , pertanyaan nya bervariasi , mulai dari kepanjangan monas hingga nama lengkap wagub .
0	sejak kuliah , saya sering makan di sini untuk menikmati steak nya . favorit dan wajib untuk dikunjungi ketika berada di bandung
0	camilan makanan ringan yang telah saya kenal bertahun-tahun sejak mahasiswa . tempat nya yang strategis di sekitar jalan dago dekat taman flexi di dekat dengan beberapa kampus di bandung dan harga nya yang relatif terjangkau membuat kedai ini sangat populer dikalangan mahasiswa di bandung . saya anggap luar biasa selain pelayanan - nya yang 24 jam , dengan harga yang relatif terjangkau .
0	pak sby banyak memberikan kebaikan untuk bangsa indonesia
0	halo kali ini saya akan mencoba makan di steak bbm , festival citylink , bandung . kali ini saya pesan beef steak , chicken steak dan potato bbm . beef steak nya lumayan enak , beef steak nya seperti dibalut tepung jadi beef steak nya terasa kering dan renyah . untuk chicken steak nya juga lumayan enak . potato bbm nya juga enak . selamat makan .
0	salah satu rumah makan non halal di bandung , menyediakan babi panggang , ambokue , bakut , dll. samcan nya kering dan enak . sate manis nya juga enak . kuah nya ringan tapi menyegarkan . buat pecinta babi panggang wajib mencoba nya
0	restoran ini selalu top . suasana nya nyaman banget buat ngobrol dengan teman , saudara atau pasangan . makanan nya juga enak . walaupun saya biasanya tidak makan berat . soal nya paling suka ke sini sore menjelang malam
2	aduh sudah jajan impulsive eh enggak enak mahal mending holland
0	terdapat banyak pilihan menu mulai dari suki , segar seafood yang bisa langsung dipilih dari akuarium , sampai berbagai macam makanan cina makanan . menu favorit ayam lapis udang , udang galah telur asin , udang masak cabe kering dan buncis cabe garam . letak restoran persis di seberang braga citywalk
1	jangkauan siar nya tolong diperluas , karena banyak daerah yang belum bisa menikmati siaran net . terima kasih .
2	pada tanggal 24 des 17 jam 9.55 wita saya dapat telepon dari telkom dengan nomor 021 1500755 telp ke nomor saya 085249682353 tentang penawaran produk dari kecepatan 10 mbps ke 20 mbps dengan biaya 100 ribu perjanjian nanti akan ditelpon lagi pada tanggal 2 januari 2018 sampai serang tidak ada . kenapa begitu ya ? saya merasa ditipu
0	korea selatan memang hebat , cinta produk sendiri . mobil yang berlalu lalang produk dalam negri , ac di hotel merek samsung bikin sendiri , telepon genggam buatan sendiri , bahkan semua di export untuk devisa . infra struktur nya melampaui kebutuhan saat ini , pariwisata nya oke banget .
1	panwaslu bekasi tangani dugaan politik praktis tiga pejabat daerah
0	antusias
2	polisi setan kayak binatang saja tidak sekolah ini semua karena suap uang kau bisa jadi petugas kepolisian binatang keparat bangsat kurang ajar .
0	cukup belanja 60 ribu produk home care di dan bisa tebus murah gopek pula
0	makan siang di sini bersama rombongan dalam perjalanan menuju lembang , dan makan siang lagi saat pulang kembali ke jakarta . makan terasa lebih nikmat beralas daun . ikan asin jambal enak , es teler sedap
2	tembak mati jokowi memakai mandat utama patriot kepahlawanan para pahlawan dan para pejuang bangsa dan nkri !
0	bu susi tidak pernah gagal menangkap pencuri ikan di laut
0	ayam goreng kecap yang manis , empuk , dan enak . berbeda dengan ayam dan cara masak ayam goreng lainnya , ayam djogja selalu jadi pilihan alternatif kalau saya dan istri ingin makan ayam enak yang tidak digoreng biasa . suasana tempat makan nya sendiri nyaman dan rasa ayam nya jelas perlu dicoba .
0	jack runner roastery dekat dengan tempat kami menginap di harris hotel ciumbuleuit . dengan kondisi jalanan yang macet di saat long week end , memutuskan kami untuk minum kopi dekat hotel saja . ternyata jack runner merupakan pilihan yang tepat . kopi nya enak dan juga fetuccini alfredo nya juga nikmat . dekorasi jack runner juga sangat unik , terdapat motor besar di dalam area kafe .
2	jenuh banget sama semuanya
0	tempat nya pas di jantung nya bandung . di tengah keramaian jalan riau . capek capek ke fo bisa makan di daken . ini kayak rumah . karena memang bekas rumah yang dijadikan kafe . tempat nya nyaman , makanan nya enak juga . dari steak , nasi goreng dan cream sup nya enak . porsi nya cukup besar dengan penyajian di piring besar juga . :
0	jumat malam , bandung diguyur hujan namun alhamdulillah ketika sampai dilokasi hujan pun reda . datang go show , karena tidak bisa reservasi diawal kami yang datang bersepuluh sedikit khawatir dengan ketersediaan tempat , dan kembali keberuntungan kami terpenuhi tanpa menunggu kami bisa langsung mendapatkan tempat di lantai 2 . pilihan menu chicken wing dan pizza ditemani dengan beberapa english tea , mango juice , lime . mantap .
0	saat saya ingin mencari makanan yang berbagai macam pilihan , saya pun di rekomendasikan oleh teman untuk makan di sini , selain murah juga nikmat makanan nya . hanya saja sedikit lama untuk kita menunggu pesanan .
0	terbaik tempat to chili dengan ur teman-teman . kane banget sih karena daerah cimenyan di dago atas begitu kan dingin ya jadi enak aja buat ngebeer buat minum cantik begitu . spicy tofu nya juara
0	lokasi . keren dan sangat pintar untuk mengatur lingkungan yang ada makanan . sepertinya ini makanan sunda dan indonesia . sangat rekomendasi
0	batagor terdiri dari siomay dan bakso tahu goreng yang di goreng dan disajikan dengan saus kacang yang gurih . selain batagor juga tersedia bakso campur dan mi ayam pedas . harus makan di sini bila berkunjung ke kota bandung . sangat enak .
0	karena terletak di belakang kampus , zama tsb - ketika masih hedon , saat istirahat saya beberapa kali ke sini . akan tetapi , menu yang dipesan selalu sama . saya lupa nama nya , yang jelas baked rice diatas nya ada keju mozarella nya . lumayan enak dan lumayan murah dari baked rice yang lain .
0	perpaduan nuansa mewah diiringi dengan live musik akustik berkelas menjadikan malam yang saya lalui begitu indah . beragam menu dapat dipilih di restorant menengah ke atas ini . bagi anda yang datang dengan pasangan pilihlah lantai atas di kesan pribadi dengan pemandangan kota dan lampu-lampu cantik menjadi daya tarik bagi kota bandung . sementara lantai bawah cocok bagi pengunjung yang ingin berbaur .
0	lokasi nya persis bersebelahan dengan hotel aston tropicana di jalan cihampelas . menu favorit di sini adalah nasi goreng kambing dan tentu saja kambing bakar . pilihlah kambing bakar bagian punggung yang ada tulung punggung nya , karena anda akan mendapatkan kejutan berupa sumsum tulang punggung yang gurih .
0	rasanya mantap untuk penyuka manis . lotek rasanya gurih jadi lebih cocok pakai nasi atau lontong harga 19 ribu . kolak nya juga enak , asinan nya segar masing-masing 17 ribu an . makanan di sini cocok untuk penyuka manis . buka sampai jam 5 sore .
0	tempat enak , nyaman , datang di akhir pekan jadi saya ramai tetapi pelayanan tetap oke hanya saya lama . makanan nya sangat bagus , apalagi menu yang ada mozarella nya itu yummy banget .
0	tempat enak banget , parkir enak banget , makanan enak banget , minuman enak banget . semuanya enak , nyaris sempurna sih menurut saya .
0	saya senang dengan pak jokowi . dia tidak pengecut dalam menghadapi setiap permasalahan di indonesia . dia juga tidak takut gagal . optimisme nya membuat semangat rakyat tak pernah luntur .
0	kami pesan sop buntut goreng . seperti bumbu dengan kuah yang tidak terlalu berminyak . hanya satu waktu penyajian lumayan lama , lebih dari 10 menit . sebaiknya datang saat belum terlalu lapar atau anda akan emosi seperti saya yang harus menanyakan beberapa kali kapan pesanan anda terhidang
2	mau marah sama telkomsel jadi nya
0	menu nya sangat banyak dan menggugah selera , harga nya juga sangat terjangkau . kol goreng yang garing , perkedel jagung yang enak dan ayam nya mantap
0	penasaran sekali melihat ramai sekali pengunjung nya , kita mampir . dan saya mencoba nasi bakmoy nya dan yang lainnya memesan sendiri-sendiri . bakmoy nya enak , kayak nya lain deh dengan yang ada di surabaya . tapi lama banget nunggu nya . karena ramai . menu rujak lotek nya juga enak .
2	tempat nya nyaman , apalagi di malam hari pemandangan nya pasti romantis . tapi rasa makanan tidak semewah harga nya . secara keseluruhan baik , overpriced untuk pengunjung keluarga , grup teman atau bisnis .
0	saung sari kahuripan memiliki beraneka ragam masakan sunda . tempat yang bersih , nyaman serta memiliki pelayanan yang ramah
0	sesudah sibuk foto sana sini berjalan kaki di parit kecil dan kolam buatan pasti lapar . kalau sudah sampai ke sini , ya paling tepat makan masakan indonesia ya . suasana asri , pepohonan tinggi dan berdaun rindang dan taman bunga , ditambah udara sejuk yang membuat badan terasa segar . pilihan saya jatuh ke nasi timbel ayam bambu . ternyata pilihan tepat . rasanya oke .
0	harus banget nyobain kopi sanger nya ! sanger itu kepanjangan dari saling mengerti antara kamu dengan sang barista . tinggal bilang mau panas atau dingin , pahit atau manis , dan voila ! kopi akan datang tepat dengan rasa yang kamu inginkan ! kopi sanger juga disajikan dengan berbagai tambahan rasa seperti nutela , milo , ovaltine , dan avocado . pas banget kalau kamu datang ke sini malam hari .
0	bubur ayam ini salah satu bubur ayam yang enak di bandung . bubur nya agak kental , ayam nya banyak . buat sarapan pagi enak . mengenyangkan .
0	untuk purbasari restoran harus order minimum 4 paket makanan dan each 120k / paket . bagaimana untuk yang ingin menikmati tidak sampai 4 orang ? lebih baik berikan rata harga yang dirasa sesuai dibanding membuat minimum person to buy , dan itu pun tidak murah . lebih baik enjoy makanan di food court nya yang bisa dinikmati dengan harga terjangkau dan ada minimarket yang menjual makanan ringan unik .
0	jual stiker kompor 2 tungku hello kitty murah dan lucu
0	sierra kafe lounge adalah tempat yang sangat luar biasa pemandangan nya . baik di malam maupun di siang hari pemandangan nya sangat mempesona . makanan dan minuman nya juga cukup lezat . jika pergi di malam hari maka terdapat live performance dari bank sierra yang sangat cocok untuk melengkapi relaksasi dengan pemandangan yang menakjubkan dari kafe ini . nb . tempat nya sangat romantise juga . jika berkunjung di malam .
0	makanan nya enak-enak dan semua worthy ! dari sajian pembuka nya sudah bikin ingin menambah ! ditambah main corse nya yang ukuran jumbo . tidak menyesal deh makan ke sini
1	teguran sri mulyani ke anies baswedan soal besar nya biaya perdinas jakarta
2	harus nya driver gocar tahu diri kalau mau cari tambahan tidak begitu cara nya .
2	ada beberapa pilihan makanan seperti mi ayam , batagor , dan oleh-oleh pisang goreng di batagor kingsley . tapi sayang harga nya seperti di restoram , tetapi rasanya biasa saja . selain itu juga pelayana nya kurang cekatan , dan tidak ada etika nya .
0	yeaay terima kasih ya giant sudah kasih banyak diskon buat aku
2	bayar mahal kualitas murahan
2	komplain sama penjual pasti kalah , karena ketentuan toko masing-masing dibuat tidak melalui persetujuan tokopedia .
2	yang lain menunggu demo jutaan orang . sabar ya . karena presiden di atas segalanya bagi mereka . begitu itu kalau orang memuja orang .
2	tagihan melonjak 2x lipat gara-gara promo habis tanpa pemberitahuan oleh indihome , tidak benar ini .
1	telekomunikasi bukan hanya untuk kota besar , tapi juga sampai ke daerah pelosok dan perbatasan negara cc : telkomsel
2	di jawa barat pilkada tidak bersih .
0	buat harga murah banget untuk ukuran makanan italia yang gede banget porsi nya . rasanya italia banget . pilihan pasta nya juga lumayan banyak . tempat nya cukup nyaman . rekomendasi bagi yang suka makanan italia . tempat nya dari luar terlihat kecil tetapi waktu masuk luas juga kok . wilayah kembali lagi to makan in ini tempat
2	maka dari itu , mari kita lenyapkan partai penguasa dipemilu 2019 . jangan pernah coblos mereka sejak pilkada . kabarkan kesemua saudara dan sanak seluruh indonesia . bahwa , partai kumpulan penguasa sangat tidak layak dipilih .
0	restoran ini menyediakan menu non halal . tersedia dimsum , makanan enak , harga terjangkau , menu tersedia bisa buat anak kecil , restoran bersih
0	salmon steak nya mantap dan harga nya terjangkau beragam pilihan steak dan segar juice , cocok untuk informal pertemuan
0	begitu memasuki jalan lengkong besar pelankan laju kendaraan , jangan sampai kelewatan . jalan nya searah dan putar nya lumayan kalau lagi macet . dari luar tempat nya terlihat kecil , tapi begitu masuk ternyata cukup luas , dengan jarak antar meja yang tidak terlalu dekat . suasana nya nyaman . pelayan nya sigap dan ramah . pizza dan pasta nya enak , terasa sekali keju nya .
1	selamat pagi indonesia salam partai demokrat dari bumi cendrawasih papua
0	recommended ! tempat sederhana . tetapi bersih . menu sederhana . sekitaran bakso , mi , bihun , pangsit tetapi penyajian nya beda semuanya enak . bapak , the pemilik , ramah sopan banget . dan jujur . karena recehan kembalian ada !
2	minuman koma apa sih kok cara minum nya aneh , rasanya aneh juga lagi
0	kafe yang nyaman , enak dan murah dengan desain kafe yang unik dan bikin betah . makanan enak dan kopi enak serta fasilitas wifi yang cepat dan tv kabel
0	kafe ini memiliki beberapa cabang di bandung . tapi aku lebih senang cabang yang di bip . tempat nya lebih mudah terjangkau , bisa menikmati pemandangan di kala sore atau hujan karena jendela nya langsung mengarah ke jalan . jenis makan nya banyak pilihan dari mulai makanan eropa sampai makanan lokal . aku suka sekali makan spaghetti tak tek perpaduan rasa eropa dan lokal . ditemani dengan ice thai . maknyus .
0	coba menu spesial dari dal ini deh , ayam ngumpet nya enak banget bisa pilih mau digoreng atau dibakar maupun kedua nya . es krim sayuran nya juga enak . pilih saung atas ya soal nya pemandangan nya bagus . nuansa sunda nya kental banget , suka . pelayanan ramah , toilet dan musala bersih . pasti balik lagi kalau main ke bandung .
0	berada persis di depan braga citi walk , resto ini ramai di malam hari . resto ini mengangkat tema vintage , salah satu keunggulan nya adalah live music yang menurut saya asik , serasa di bawa ke bandung tempo dulu .
0	spagheti yang enak dan suka-suka yang enak banget . sangat cocok di makan di tempat yang dingin . tempat yang indah di malam hari dengan pemandangan lampu-lampu kota bandung .
0	tempat nya keren apalagi skywalk nya , makanan nya enak , pelayanan nya memuaskan . rekomendasi banget buat makan malam romantis bareng pasangan tidak ada nyesel nya datang ketempat ini , ayo teman-teman yang mengaku hits datang deh ke sini .
0	ajip bangetlah rasanya . recomend banget juga bagi penikmat bubur nih . kalau soal ulasan sih apalagi ya yang pasti enak nih bubur ayam . cobain deh .
0	tempat ini sehari-sehari saya ku njungi karena dekat dengan koran dan kampus saya unpar . sebenarnya mayoriyas yang datang ke sini pergi untuk minum beer . dan memang tempat ini mantap sekali untuk minum beer ! makanan nya pun berkualitas !
0	makan siang yang kepepet ya di sini saja , haha tapi yang paling enak beer float nya mantap banget . selamat makan .
2	berantakan
2	saya makan hdl bukan satu dua kali dan tiap kali makan selalu jengkel dengan pelayanan nya . penyajian ikan goreng kering selalu kelupaan sambal kecap nya . dan kalau diminta harus panggil sampai ke 5 orang spt masih juga tidak mau dikasih . tempat jorok minta ampun . malu maluin deh kalau untuk direkomendasikan . untuk pemilik hati-hati saja jangan sampai usaha bangkrut gara gara pegawe yang kerja asal asalan
0	restoran bergaya jepang sayang nya tidak menyediakan ramen sejenis nya sushi hanya ada salad sushi , yaitu sayuran yang di roll seperti sushi makanan pelayanan harga lokasi saran pribadi saya kalau datang ke sini , wajib coba tofu pudding ini enak banget
1	resmi diusung gerindra , kakak rivai selamati agus - tol lewat
0	tempat nya luas banget . ala kamu bisa makan dan harga nya cukup terjangkau . cocok untuk acara yang orang-orang nya banyak .
2	semua pejabat itu sama saja . yang penting mereka itu bisa memuaskan kantong mereka sendiri . maka dari itu bisa beli rumah sana sini , mobil mewah .
0	saya bukanlah penggemar berat kambing karena tidak tahan dengan bau nya , tapi makan di tempat ini , saya seperti tidak sedang makan kambing ! daging nya empuk , enak dan tidak berbau . suasana resto nya pun enak dan nyaman
0	lokasi restoran tidak di jalan besar , jadi harus masuk jalan kecil tetapi cukup untuk 2 mobil dan berkelok-berkelok . menu andalan adalah nasi liwet paket , boleh pilih antara ayam goreng atau gurame . rasanya enak plus jus strwaberry saran tambah susu , segar asam manis .
0	ini kambing bakar paling enak dibandung menurut saya , padahal slogan nya terenak kedua ya , nomor satu nya apa ya hehe . , dibakar nya pas , sehingga daging nya empuk dan juicy plus ada kering2 nya di luar , saya biasa memesan tanpa nasi jadi minimal harus memesan dua porsi biar kenyang alasan . sambal kecap nya simpel , tetapi itu tidak terlalu pengaruh karena bumbu-bumbu nya sudah meresap ke daging nya .
0	mungkin aku seperti rasa-rasa indomie begitu kali ya ? mau kesal tapi lihat muka nya jadi gemas
0	kemarin ke sana buat nyobain menu asian bbm nya . peristiwa baru begitu dari padma . padma nya sendiri tempat nya sudah nyaman dan enak banget buat makan kumpul-kumpul sama teman-teman . asian bbm nya juga enak terutama daging mongolian bbm nya parah banget enak nya . 5 stars buat padma hotel !
0	pertama kali memasuki bistro ini cukup sepi karena saya datang memang jam 1 / 2 12 malam waktu itu cuma ada sekitar 6 pengunjung yang sedang menikmati hidangan nya , bistro ini tempat nya nyaman cocok buat bersantai dan di sini tempat nya juga strategis dekat sekali dengan stasiun kereta api , di bistro ini saya pesan sup tomyam rasanya enak isi sea food nya juga banyak .
2	mulut ade mulut sampah , walau dosen ptn ternama , noda . buat ui .
2	jangan berharap lebih mahfud md anda itu berwajah 2
0	saya lihat tempat nya memang cukup nyaman untuk nongkrong bersama kawan-kawan , namun mungkin karena upnormal yang kini memang sedang mengetren di kalangan anak muda sehingga sering nya penuh , dan butuh waktu yang cukup lama untuk menunggu pesanan .
2	hanya untuk pencitraan demi mencari simpati dari rakyat yang sudah tidak percaya terhadap polisi . lihatlah kehidupan jenderal - jendral polisi semuanya kaya raya .
0	saya termasuk salah satu orang yang cukup setia dengan kampung daun dari awal buka di tahun 2003 kalau tidak salah , kualitas makanan awal nya oke , tapi semenjak makin ramai dan makin ke sini , makanan yang disajikan tidak seperti biasanya dan terkadang pelayan terkesan cuek sekali , kita mesan beberapa jenis makanan tapi yang datang sudah dengan kondisi dingin dan tidak menarik , tempat menarik .
0	selain bakso , di sini ada berbagai macam menu . rasanya enak tetapi harga nya lumayan untuk anak kesan . tempat nya bersih dan desain nya modern , sama seperti cabang baso malang karapitan lainnya .
2	mau marah , kenapa jaringan indosat selalu jelek dan hilang terus
