0	sebenarnya agak lucu juga sih ke bandung , tapi kok makan pizza hut . hanya karena lagi ingin pizza . jadi ya mampir ke sini . rasanya sama-sama saja sih sama yang di Jakarta .
0	halo kali ini saya mengunjungi mc di yang di istana plaza . tempat nya menarik untuk nongkrong karena di sini ramai pengunjung nya . dan ada layanan drive - tiru nya juga , kadang saya suka makan di sini atau kadang saya menggunakan drive - thru . saya rekomendasikan untuk makan di sini .
2	sombong
0	pelayanan dari mbak isna di 18th trans luxury ini sangat memuaskan , ramah selain itu makanan nya enak dan bervariatif . tempat nya romantis cocok untuk merayakan hari-hari spesial seperti anniversary dengan pemandangan kota bandung di saat malam hari .
2	waktu pertama buka , enak . tetapi makin ke sini kualitas nya menurun . mi nya kurang rasa , juga kuah nya .
0	tempat yang bagus dengan pemandangan kota bandung dari ketinggian the trans luxury hotel bandung . cocok untuk merayakan hari istimewa dengan sajian makanan yang mewah . banyak opsi untuk memilih wine yang diinginkan . nyaman tempat . bagus atmosphere . pelayan yang ramah siap membantu kamu dengan baik . saya dilayani oleh pelayan yang bernama agus . orang nya baik .
0	yang protes asal mangap semrawut era jokowi era ahok era djarot amburadul . sekarang lebih keren tertata . soal jalan dipakai atau alih fungsi itu kewenangan gue teken pergub selesai . di mana-mana kota besar begitu , disuroboyo wali kota ibu risma ada jalan st . wonokromo . ditutup sebagian buat pedagang kaki lima
0	kenapa sate hadori empuk , rahasia nya adalah kami supplier nya , usaha bangkit bersama adalah supplier daging kambing untuk rumah makan sate hadori stasion bandung selama puluhan tahun . berawal dari kegigihan dari leluhur kami mendiang h . iyon taryana . kami menjadi supplier daging kambing untuk beberapa rumah makan sate di kota bandung termasuk rm . ampera yang cabang nya di-mana . untuk konsumen luar kota bisa diambil . lanjutan
0	keren . tetap semangat bunda neno . bravo koalisi adik makmur mempercayakan posisi penting untuk ibu-ibu . kami apresiasi makin mantap untuk kemenangan
0	saya bersama teman saya datang ke sini untuk acara arisan . tempat nya nyaman dan berkonsep minimalis , sangat cocok untuk nongkrong dan bersantai dengan teman-teman . saya memesan menu favorit saya yaitu aglio olio tuna dan ice tea . rasanya oke , seperti kafe sejenis lainnya .
2	banyak kafe di dago atas yang sudah di datangi , kali ini mencoba kafe lawangwangi , dulu cuma galery karena saya sering datang untuk melihat pameran seni . tempat cukup oke , tetapi masih banyak tempat di dago atas yang jauh lebih oke dari ini . kami pesan steak grill chicken dan chicken schnitzel , kurang enak dan hambar .
2	data tersebut jelas kinerja jokowi lebih buruk dengan asumsi output nya sama
0	sengaja saya dan pasangan dan juga teman ingin eksplor tempat wisata di bandung dan juga tempat nongkrong yang lagi hits . akhirnya kami pun mampir di warkop modjok yang lokasi nya berada di jalan pinus raya . dibilang mojok , sebenarnya tempat ini tidak mogok juga sih . tapi memang berada di antara perumahan kompleks . warkop berkonsepkan ruangan yang asri , unik , dan juga interior yang indah .
2	jual ayam bakar taliwang tapi ayam yang disajikan seperti karet dan tidak memuaskan , dan rasanya hambar , sambal nya juga alakadar nya , akan tetapi minuman nya oke , dari keseluruhan sangat mengecewakan dan saya tidak akan ke dua kalinya ke sana lagi
0	masakan sundanise tang enak adalah sambal nya . ayam goreng gurame goreng dan nasi panas wow enak nya bisa makan banyak nasi nya .
0	tidak mengecewakan
2	terakhir kes ini 2 tahun lalu pelayanan masih oke , ramah dan berbicara bahasa sunda , ialah secara tempat nya di bandung , resto sunda , tapi sekarang saya ke sini cerita nya minta ke pelayann nya gabung 3 meja , eh itu pelayan malah bilang pesan saja dulu bu , saya bilang , saya rombongan , pesan nya nanti saja kalau rombongan sudah datang , eh itu pelayan malah gabung 2 meja . saya jadi tidak nyaman dengan tempat ini .
2	rasa bersyukur atas makanan ini baru kerasa di sini , di bagian bumi lain yang rasa makanan nya tidak cocok di lidah orang indonesia . rasanya aneh makan macaroni rebus sama timun dan tomat featuring rasa yang hambar .
0	kebetulan melintas gedung sate untuk foto-foto , pas lapar dan mampir tanggal 27 desember kemarin saat liburan natal di bandung . pengunjung padat dan antri nya bikin lapar kabur . kami kesulitan dapat meja kosong lho , ada begitu hanya meja yang sudah terisi dan ada masih kosong namun sudah diblok orang . tapi . makanan nya enak tenan . semua menu khas jawa dan asli indonesia sehingga pas buat lidah saya .
2	ini bocah tidak tahu diri sumpah . musnah saja dari peredaran bumi mahkluk seperti ini .
0	sangat cocok jika anda mengunjungi congo di malam hari . anda dapat menikmati indah nya lampu-lampu kota bandung di malam hari dari kafe sambil menikmati hidangan . karena waktu itu kami sudah bersantap malam sebelumnya , kami memilih untuk memesan minuman saja .
0	kalau yang liburan ke bandung dan lembang harus menyempatkan makan di sini , kalau akhir pekan mengantre tetapi setimpal rasa makanan , harga dan tempat nya
0	resto dengan sajian ala anak kos dengan harga sesuai kocek anak kost pula , rasa cukup enak , interior yang nyaman dan artistik , cukup untuk hang out dengan teman maupun keluarga .
2	bingung saya dengan semua ini galau
0	berkumpul dengan teman sambil makan , memiliki 2 lantai , makanan dan tempat bersih yang berada dalam ciwalk
2	susah ya sama orang primitif di tolikara papua yang bodoh , orang lagi salat id malah dibubarkan . si hitam yang tolol di tolikara
0	hasil keringat mu besok , tidak akan terbuang sia-sia
2	aku bosan dengan drama sinetron ini . ku mohon segeralah berakhir . lelah aku mengikuti alur nya .
1	pkb pertimbangkan tinggalkan ridwan kamil jika usulan nya tidak diakomodir
2	indosat oh indosat kenapa tiap hari kamu membuat marah pelanggan kamu . sampai kapan kau php seperti ini .
0	penuh music , dan lumayan asik sambil menikmati espresso . makana nya lumayan enak , menu yang saya suka pisang keju .
0	meskipun jalan yang ditempuh cukup sulit dan harus menanjak namun terbayar dengan pemandangan yang didapat . rasa makanan juga enak meskipun dengan harga yang cukup fantastis . menjadi salah satu kafe favorit saya di bandung karena tidak pernah kecewa dengan the valley
0	stayed untuk 3d2n di premier room , dapat complimentary afternoon tinggi itu yang makanan ringan nya enak enak , tradisional makanan ringan nya tidak ada yang tidak enak . suami suka yang manis dan saya suka yang asin klop ! malam nya order lasagna dan pizza , sambil menunggu makanan sampai dapat roti yang bisa mengganjal perut yang kena udara dingin bandung hihi . begitu sampai , makanan nya enak .
1	anak bungsu susilo bambang yudhoyono , edhi baskoro yudhoyono atau ibas baru saja dikaruniai anak ketiga .
2	ayo para muslim , viralkan dan blokir aplikasi biadab ini , jangan sampai anak cucu kita menjadi korban kebencian kaum kafir awal munafikun . sebarkan sebanyak-banyaknya !
0	saya boleh bilang ini adalah resto yang cocok untuk keluarga . sambil istri saya belanja oleh oleh dari kartika sari , saya bisa menikmati makan siang di resto ini . anak anak saya bisa bermain di tempat bermain dengan tiket yang murah . menu nya biasa saja dan rasanya lumayan .
0	meskipun makin menjamur nya orang cina makanan si bandung , queen selalu menjaga rasa dan kualitas makanan , cangkang kepiting goreng , haisom dan sop asparagus sangat enak dan mungkin terbaik di bandung . harus dicoba pasti ketagihan
0	enak rasa masakan nya apalagi kepiting yang menyenangkan kita memilih kepiting nya sendiri dan masih segar . selalu mampir ke sini kalau setiap ke bandung .
2	kami datang karena banyak ulasan yang baik atas restoran tokyo connection , suasana dan tempat menyenangkan tetapi rasa dari makanan yang kami pesan sungguh di luar dugaan . buruk :
1	korupsi e-ktp setya novanto dan sederet drama nya
2	tolong media jangan membesar kan berita kekalahan indonesia takut nya untuk pemain trauma atau susah bangkit dari keterpurukan .
0	makanan menurut saya biasa saja , hanya suasana yang membuat betah berlama-lama , untuk makan di tempat yang nyaman butuh mengantre panjang dimalam minggu , ketika kami berkunjung . pelayanan ramah dan cepat
0	tempat yang nyaman untuk menghilangkan segala kepenatan , dengan suasana alam yang menyejukkan , bisa menjadi tempat favorit untuk wisata , tidak menyesal deh kalau sudah ke dusun bambu , asyik tempat nya
2	mudah sekali dibohongi , dasar wanita murahan
0	tempat main sekalian tempat makan banyak pilihan nya , harus beli voucer dulu , harga makanan nya mahal bingit , danau buatan nya bagus dan suasana romantis
0	terima kasih sudah memberikan ruang bagi perokok seperti saya , dan pemandangan yang diberikan sangat menarik . usulan dari saya , variasi pada sarapan sarapan diperbanyak lagi . terima kasih
2	saya bersama keluarga makan siang di sini , di lantai 5 dan di seberang kami tepat area kitchen . kami sangat tidak nyaman , karena staf kitchen nya sangat berisik sekali dan yang mereka bicarakan itu dengan bahasa sunda yang kasar dengan suara lantang . makanan cukup baik , tempat menunjang , tapi dari kenyamanan nya tidak ada nilai nya .
0	tidak penipu
0	saya dan istri saya pagi hari liwat di puri bambu . ternyata ada makan pagi di alamat tersebut . juakan di luar gedung . di tempat parkir nya . tersedia macam-macam makanan , sedia bubur ayam dan nasi rames . kita bisa pilih beberapa macam sayur nya . harga cukup murah .
2	gnpf fpi fui pas jamaah ansharut tauhid mmi penceramah yang sering mendiskreditkan pemerintah , menghina dan mengharamkan orang atau kelompok lain .
0	untukj pertama kalinya kami masuk ketempat ini , untuk men cicipi masakan chinese makanan nya yang lengkap sekali . , tapi kami hanya memesan ikan gurame asam manis dan ifumie special saja . rasanya enak sekali .
2	orang kalimantan anjing semua binatang luh babi , manusia primitif dayak kelakuan lu enggak benar semua anjing , kebanyakan tinggal di utan rimba tidak tahu peradaban modern mati lu semua busuk
0	kebanggan kita terbesar adalah bukan tidak pernah gagal , tetapi bangkit kembali setiap kali kita jatuh
2	nasi campur ab du tikungan jalan kalipah apo dan pajagalan . nasi campur dan nasi hainam . ya biasa-biasa saja . tak ada yang spesial . juga daging nya di potong terlalu tipis . pelayanan dan pelayanan juga biasa-biasa .
0	ikan selalu jadi pilihan terakhir untuk jadi lauk . tapi saya bisa makan bawal bakar goreng di redsdipo , sejak masih kaki lima - an di jalan . diponegoro . enak ! sambal nya walaupun cuma cocol sedikit bikin mata melek , panas di mulut tapi tidak bikin sakit perut . terima kasih sudah buka di jakarta ! bisa ngobatin kangen sama bandung :
0	saya makan di kampung daun membawa keluarga saya , pertama kali sampai di tujuan , suasana bandung sunda nya berasa banget , keren dech . makanan asli sunda juga tersaji dengan rasa yang menurut saya sangat terasa gaya sunda nya . hanya waktu itu sangat penuh jadi agak lama deh menunggu makanan nya . tapi semuanya bagus .
0	halo kali ini saya mengunjungi nasi campur tjiang di bandung , nasi campur nya enak sekali , rasanya lezat dan mantap , tempat restorannya nya pun bersih dan nyaman , pelayanan nya bagus dan cepat .
2	aku 100 % tidak suka dan tidak akan memilih jokowi .
1	sekjen partai demokrasi indonesia perjuangan pdip hasto kristiyanto enggan menjelaskan kebenaran isu perombakan pasangan calon gubernur dan wakil gubernur jawa timur ,
2	terlalu pintar berkilah , merangkai kata , dan mencari alasan untuk membela diri . jika sudah ketahuan , si penipu biasanya sangat pintar berkilah , merangkai kata , mencari alasan demi alasan untuk membela diri , meyakinkan korban nya bahwa dia jujur , dia tidak bersalah , dan seterusnya . bagi yang mudah tertipu , dia mungkin masih percaya pada alasan-alasan berkilah tersebut . namun bagi orang yang bersikap kritis , mereka pasti melihat banyak hal aneh , bahkan kejanggalan dan saling berkontradiksi pada ucapan-ucapan dan alasan-alasan si pembohong tersebut .
0	lokasi tempat makanan ini ada di daerah dago dekat dengan factory outlet yang ada . bentunk nya seperti rumah kuno dan kita makan di garasi nya . favorit nya nasi timbel komplit , rasa juga lumayan enak , sayur asem nya juga enak .
0	restoran dengan konsep pedesaan , restoran favorit untuk keluarga dan pasangan . bukan hanya menu nya yang beragam , rasa masakan yang enak , suasana makan di tepi sawah yang jarang ditemukan di tempat lain . sangat rekomendasi .
0	menyediakan masakan sunda yang cukup enak , bisa duduk lesehan di meja . tapi agak banyak nyamuk karena tempat nya banyak tanaman seperti hutan . selain tempat makan , ada penginapan nya juga . secara keseluruhan baik nyaman sih .
2	saya tidak suka belanja online karena kapok sudah kena tipu
0	tidak bosan
0	enak berdiam diri lama di sini , makanan enak , tempat rapi dan nyaman , bersih kafe nya . banyak pilihan makanan
2	malang sekarang semakin macet , bikin malas pergi ke malang
2	yang sekarang harus diwaspadai bahaya nyata hti dan pks alias pki syariah pengusung khilafah rongsokan budaya arab .
2	benar-benar fuck nyepi sialan si goblok ini , aku jadi tidak bisa menonton arsenal main , aku sumpahin acara gila nyepi ini semoga tahun depan pas ogoh-ogoh terbakar semua yang merayakan , fuck kamu hindu
0	padar yang pesona nya tidak pernah pudar dan tidak pernah gagal bikin jatuh cinta lagi dan lagi .
0	saya coba yang di grand yogya kepatihan . lantai . 5 saya pesan bakso malang super komplet . rasanya enak . kenyang . harga juga masuk akal .
0	ketika punya rencana merayakan ulang tahun dan rapat keluarga , saya mencoba memilih beberapa lokasi restoran yang strategis . kemudian terfikir untuk mencoba di ph bubat , setelah kontak dan dilayani dengan ramah , ternyata ph bubat menerima untuk grup keluarga sebanyak 30 orang . ketika kami datang ke lokasi ph bubat , ternyata kami sudah disiapkan tempat yang sangat privat tetapi tidak mengganggu pelanggan yang lain . mantap sekali .
0	di sini anda akan menemukan tempat yang sangat nyaman karena suasa yang sejuk belum lagi dengan suasana seperti dikampung
0	bakmi rica kejaksaan menyajikan mi rica yang sangat nikmat dan pedas . yang menjadi daya tarik utama nya adalah tambahan daging rica pada mie nya yang cukup melimpah dengan aroma dan rasa yang pedas gurih . bagi yang tidak menyukai makanan pedas , juga tersedia bakmi / yamien asin dan manis juga bakmi kuah dengan pilihan tambahan bakso , pangsit , babat , dan lainnya .
0	sop ikan di tempat ini memang paling enak sekali , kami memang baru pertama kali ini ke tempat ini . dan suasana nya nyaman dan adem dan untuk area di luar juga enak dilihat . dan kami juga memesan menu lainnya seperti ayam paket dll. harga nya tidak mahal relatif .
0	lokasi nya strategis dan suasana nya nyaman untuk ngobrol . makanan nya banyak pilihan dan enak harga nya juga terjangkau
2	tempat nya cantik untuk foto-foto . sangat nyaman . sayang teh ring - nya tidak bisa tambah air panas padahal harga teh nya juga tidak murah . lava kue - nya tidak terlalu leleh di dalam nya .
0	sebetulnya ini pengalaman pertama saya datang ke sini , yang saya pesan adalah croissan cokelat , stroopwafel , dan lychee freeze tea . croissan rasanya enak , lembut , dan cokelat nya tidak terlalu manis , saya suka . stroopwafel - nya tidak seperti stroopwafel yang biasanya , rasanya enak tidak terlalu manis . lychee tea juga lumayan enak .
2	pakai mobil ford yang kata nya irit nyata nya boros tidak untung
0	makan di sini punya keunikan tersendiri dengan disajikan prasmanan berbagai menu khas sunda lauk yang bermacam2 dan nasi liwet membuat selera makan bertambah . minuman seperti cendol dan es goyobod khas sunda melengkapi menu makanan yang tersaji . selain itu penyajian menggunakan piring dan gelas kaleng jadi teringat di rumah nenek .
2	ini mah cuma pencitraan dari pak prabowo saja . mana mungkin dia bisa membangun indonesia agar lebih maju . janji palsu semua .
2	bahaya
1	tweeps , bila kamu selesai transaksi mengirim , pastikan cek kembali alamat di resi sebelum meninggalkan counter jne pondok timur ya
2	bani kampret doyan micin kalau pakde jokowi imlek pasti dibilang haramlah dan antek kafirlah tapi coba kalau anies cari muka pakai baju imlek dan ke vihara petak sembilan , apakah sialan masih konsisten berani mengucapkan ke anies haram juga dan antek kafir ?
2	buni yani dibayar seseorang yang hingga saat ini masih main politik pecah belah khusus nya agama dan umat dicatut disalahgunakan dengan cara biadab mengatas namakan ulama palsu kelakuan kriminal .
0	makanan nya berkisar antara rp 20.000 - rp 100.000 tersedia banyak pilihan menu masakan dan untuk rasanya lumayan enak
0	aku tidak pernah cemburu atau pun iri dengan kemenangan orang lain . karena bagi ku setiap orang selalu mendapatkan sesuatu sesuai dengan yang mereka lakukan .
0	ini adalah ke 5 kalinya kami mengunjungi tempat ini . makanan yang cukup enak ditambah suasana yang unik seperti di desa atau hutan . tempat makan berada di saung-saung sehingga cukup privasi .
0	saya pakai paket simpati loop dan jaringan nya lumayan bagus
0	the valley restoran ini pemandangan ke kota bandung timur no. 1 . malam hari terluhatn nya indah sekali , lampu kedap kedip indah sekali . makanan dan minum an nya okoklah
2	nakal
0	okay , beberapa kunjungan terakhir ke ipar di bandung , kita diajak makan kemari , wich adalah obviously not halal . nasi campur di-mana ya sama , isi nya itu-itu saja gausa dijelaskan lebih lanjut ahaha . tapi kadanga ada saja yang nasi hainam nya tidak enaklah , babi madu nya kurang garing , samcan tidak ada rasa dan keras . tapi di sini , ala adalah sempurna , dari nasi hainam , chasio garing .
0	bakso dengan ceker atau kaki ayam merupakan sensasi yang menakjubkan . enak banget deh pokok nya selain bakso masih banyak menu yang lain . pokok nya direkomendasikan banget deh
1	nanda mulai bekerja di dhl indonesia bulan depan
0	terletak di dalam mal trans studio atau biasa disebut trans stusio mal . jika anda merasa lelah setelah shopping , anda bisa beristirahat dan mencoba menu makanan di suis butcher , steak nya tidak alot dan menu nya banyak . selamat mencoba
0	twitter benar-benar tempat ternyaman untuk bermedia sosial
0	salah satu makanan thailand yang cukup otentik di bandung . dengan bahan baku yang selalu terjaga kualitas nya dan tentu saja tanpa msg .
0	di antara semua restoran sunda di bandung , saya paling suka ke ampera . selain suasana nya sunda banget , menu nya lengkap dengan harga yang terjangkau . banyak cabang di mana-mana sehingga memudahkan .
2	kesal sendiri jalan di gang yang sempit terus ibu-ibu berjejer jalan nyamping penuhkan jalan sambil gosip gosip
0	suasana di sini sangat enak , makan di atas tebing dan udara yang dingin , dengan lantar belakang lampu-lampu kota bandung . restoran ini sangat terkenal di bandung , untuk menu favorite ku beef steak karena steak di sini real tanpa msg
2	tua bangka tidak tahu diri , bukan nya makin sadar dan istirahat di masa tua malah bikin masalah . mencalonkan diri lagi jadi presiden . nanti linglung
0	sangat cocok untuk makan sambil menyegarkan dengan pasangan atau keluarga sambil tamasya , beragam menu makanan yang enak , pemandangan yang indah juga ada air terjun kecil disekitar dengan udara yang sejuk , mudah dijangkau dari terminal ledeng bandung posisi terletak di dalam komplek triniti
0	fasilitas oke , anak sangat riang , ada atv , mini farm , danau nya bagus , makanan lengkap , layout taman alami dan tertata
1	magic Jakarta belanja retail harga grosir
0	datang ke the restaurant untuk sarapan buffet . variasi sangat banyak dengan rasa yang enak . harga nya worth it dengan apa yang kita dapat . pemandangan indah dari kehijauan yang tidak bisa dibeli di tempat lain . thanks to diah as a gro untuk info nya . mas artha untuk spesial minuman the hulk seger banget , terbaik bartender di bandung deh . untuk daus dan richard terima kasih .
0	resto nostalgia yang wajib dikunjungi , tempat yang nyaman buat keluarga , parkir yang luas . hidangan nya hampir semua enak , terutama steak , saslick dan es krim .
0	apabila ingin memesan batagor di sini ada baiknya memesan dahulu sebelumnya karena sangat ramai dan panas udara nya oleh asap gorengan , antri nya juga selalu panjang dan parkir selalu sulit .
0	mi masak di sini benar-benar enak . porsi nya juga gede , cukup bikin kenyang seharian . mi masak berupa mi lebar dengan kuah berwarna keruh tapi soal rasa juara dunia deh
2	wkwkwk puas banget sudirman said sama ida kalah di hitung cepat lem bagai survei
0	batagor nya enak , tapi saus kacang nya lumayan pedas . agak mahal menurut saya . menu cukup beragam . tempat nya strategis tapi parkiran terbatas .
2	meski sudah menjadi pesakitan masih saja berani lancang dan arogan terhadap ulama , bahkan mengeluarkan ancaman dan menghinakan nya . lalu bagaimana jika dia berhasil menjadi penguasa ? sungguh itu akan menjadi bencana besar bagi umat islam .
2	marah
0	tempat makan yang santai dan romantis bersama teman / keluarga / pacar , pelayanan yang bagus dan cepat , makanan tersaji dalam waktu yang cepat , pemandangan pemandangan yang bagus lantai 2 , sayang live musik hanya dapat dilihat di lantai 1 , secara keseluruhan baik rekomendasi
0	batagor kingsley adalah batagor terbaik di bandung . cobalah batagor kuah nya , yang memiliki kombinasi antara kuah yang gurih dan batagor yang kering . batagor adalah isi dari bakso tahu dan juga siomay yang digoreng . tambah kacang dan kecap dan jadilah makanan yang sangat enak .
0	zaman dahulu . itu yang selalu diceritakan . memang , resto ini mengusung kejadulan , baik itu dari menu maupun alat perkakas makan . dari mulai masuk saja sudahbterasa zaman dahulu . tempat makan nya hanya berupa bangku panjang dan meja kayu . sangat sederhana . bahkan bilah kayu potong pun snegaja ditampilkan . bangku panjang cukip untuk delapan orang duduk berdekatan . dengan lebar meja yang pendek , dijamin makan bersama keluarga serasa menyenangkan .
2	dapat bonus tcash 12.500 tapi tidak bisa dipakai buat beli pulsa yang seharga 10 ribu h aneh
1	maksud nya 64k itu buat tukar 4 tidak bayar 64 ribu
0	liburan ke bandung pasti nya mencari kuliner nya dong . nah jangan sampai kelewat nih bakmoy mahmud , lokasi nya ada di jalan mahmud pasti nya . letak nya ada di gang kecil . setiap kali ke bakmoy mahmud pasti ramai sekali , ya karena rasanya tidak bohong , enak .
2	ketika sedang memesan saya menumpang ke kamar mandi dan melihat ada saringan teh yang terletak di lantai wc . sangat shock melihat nya . pelayanan juga sangat sangat standar . tidak ada yang spesial di sini . mohon maaf saya berkata yang sejujur nya .
1	mobil toyota rush mengalami kecelakaan di ruas tol jomo jombang - mojokerto .
2	lemah otak banget anjir bikin tidak senang tidak lagi-lagi dah pakai indosat
1	cari harta karun leluhur nya si di gunung huaguo .
0	saya tidak marah pada nu walaupun begitu pada ku
2	allah kan bukan orang arab . tentu allah senang kalau ayat-ayat nya dibaca dengan gaya minang , ambon , cina , hiphop .
2	indihome gangguan terus bayar nya saja mahal . tapi bermasalah terus
2	iya , xiomi memang murah sih , tapi banyak juga yang abal-abal spek nya
0	rumah makan ini selalu ramai karena menyajikan makanan sunda yang bervariasi dengan rasa maknyus . rumah makan ini menggunakan perabot makanan zaman dahulu , memakai piring dan gelas dari seng . tamu memilih dan mengambil sendiri hidangan yang tersedia prasmanan kemudian langsung dihitung dan membayar di kasir . banyak menu yang sudah jarang kita jumpai di restoran lain sehingga dapat mengobati rasa kangen pengunjung .
0	lebih banyak dikenal dikalangan mahasiswa . porsi makanan dan minuman yang besar dan enak tentunya menajdi salah satu alasan mengapa mahasiswa sering mengunjungi nya . saya menyukai menu minuman jus nya yang segar dan sehat terutama cavendish . it s sangat delightfull dan net untuk me . setiap habis mencari bahan di unpar saya selalu menyempatkan diri untuk berkunjung ke sini .
2	siapapun yang pakai baju papua , baju nya tetap cantik dan bernilai budaya , orang yang makan tetap saja begitu , yang cantik dan jelek tetap jelek
0	menyediakan makanan yang cocok di lidah . aoo ikan yang khas dan enak . jengkol tumis pepaya juga tidak berasa pahit . tempat lumayan nyaman untuk menjamu teman ataupun makan bersama keluarga . sayang nya tempat parkir sempit . jadi harus parkir di bahu jalan .
2	dizaman ini masih ada mbak mbak online shop yang tidak tahu aplikasi gojek gocar gosend ya allah bodoh sekali : jualan dihutan aku rasa
2	berapa banyak harapan swasembada terwujud , tapi kalian cederai harapan kami dengan kinerja yang buruk !
0	paling asik tempat nya selain luas dan nyaman , bisa di luar atau di dalam menu nya banyak dan beragam salad nya enak dan segar , kalau es krim saya tidak begitu suka tidak tahu kenapa . paling pas makan ramai-ramai per 4 - 6 orang setiap awal bulan buat mentraktir .
2	payah pelayanan jne , pakai paket yes tetapi sampai nya 3 hari , kasihan sudah terlalu banyak costumer yang kecewa , saya nya salah pakai jasa ini
0	restoran ini berbentuk kompleks yang berupa saung-saung yang berada di antara kebun-kebun , ada air mancur dan aliran sungai yang bergemericik . sangat indah di malam hari karena pijaran api peneangan jalan memperindah suasana . makanan cukup enak , tetapi bukan yang enak sekali . suasana yang lebih menonjol di tempat ini .
0	tidak terlalu jauh dari lembang terletak di jalan kolonel masturi dilalui oleh kendaraan umum , suasana khas pegunungan sangat sejuk , tersedia berbagai menu makanan dan toko-toko , juga bisa menikmati pemandangan persawahan .
1	karena subscriber netmediatama sudah 1 juta , kita pilih subscriber beruntung untuk sehari jadi crew net .
