0	bakso malang nya dan kuah yang enak . ada batagor nya . sangat terkenal karena rasanya . tempat nya kecil , sempit dan agak pengap bagian dalam . kurang enak untuk berlama lama dan bersantai . lagipula bau dari batagor dan baso nya akan menempel di baju kita apabila berlama lama di sana .
0	saya salut sama bapak baswedan menata jakarta sampai semrawut gini jalan nya dizzyface
0	tidak melelahkan
2	sok
1	bawaslu terima 10 laporan dugaan pelanggaran saat pilgub riau 2018
0	batagor riri merupakan salah satu jenis makanan yang sering saya beli sebagai oleh-oleh dari kota bandung . rasa batagor - nya enak dan memiliki kemasan yang rapi sehingga gampang untuk dibawa . harga satuan nya sekitar rp . 10 ribu , yang menurut saya agak kemahalan jika dibandingkan dengan jenis batagor lainnya di kota bandung .
2	biadab
0	giggle box ialah restoran yang menawarkan berbagai macam dan ragam olahan steak yang beraneka ragam yang anda serta teman teman wajib mengunjungi ini , sekadar bersantai ataupun reunian memanglah tempat ini paling cocok untuk dikunjungi .
2	pesan moral yang disampaikan jokowi sangat tidak berkualitas
1	lagi , kader pdip di ttu menyatakan mundur dari kepengurusan partai
2	cfd kali ini mengecewakan , kotor sudirman , dan tidak bisa dilewatkan sepeda .
2	dengan ini saya semakin membenci hari senin
0	walaupun tempat nya tidak seterkenal tempat makan jepang lainnya , tapi untuk urusan rasanya cukup enak kok , suasana nya pun dapat . masakan olahan jepang nya cukup otentik
2	berharap mendapatkan kuliner jawa barat yang enak . ini bukanlah tempat nya . ! secara konsep , tempat ini sangat bagus , walaupun akses nya agak ribet sedikit . dari tampilan dan aktivitas setiap gerai sudah tampak bahwa ini bukanlah gerai kuliner yang sedap . ! jika kita terbiasa menikmati kuliner , insting kita pasti tahu bahwa di tempat ini hanya tersedia kuliner hore-hore alakadar nya dengan mengandalkan msg sebagai penyedap . !
0	ya , mungkin karena saya berkunjung di sore hari , dan saya memilih untuk duduk di saung , nyamuk nya lumayan mengganggu . lampu temaram menjurus redup membuat mata saya sakit . untuk makanan standar sunda resto , enak dan sambal nya oke .
2	rugi banget sudah berlangganan indihome sangat tidak untung
2	bodo lo pakai jawa lagi .
2	ustad felix apa tidak malu , maka dari itu jangan kepedean kalau jadi orang , tahu diri kenapa tad ?!
0	saya makan di cabang lembang . lumayan juga , yang jelas bersih tempat nya . buat penggemar bakso bisa dicobakan .
2	tresemme anti rontok kok malah bikin rontok
0	ini tempat makan favorit kami jika ingin menikmati hidangan steak / pasta . saya tergila-gila dengan potato gratin yang disajikan complimentary dengan main course . steak - nya nomor 1 sejauh ini terbaik di bandung dan saya juga menyukai lasagna - nya . top , apalagi mereka sekarang membuka tempat baru yang lebih luas dibandingkan kafe lama di jalan . rajiman .
0	ada menu kepiting saus tiram yang benar-benar lezat dan menu-menu lainnya yang tidak kalah lezat nya . rose flower restoran memang luar biasa . untuk pecinta kuliner yang ingin mendapatkan kepuasan maksimal dalam cita rasa masakan yang lezat . dapat menjadikan rose flower restoran sebagai pilihan dijamin ketagihan
0	lemari pendingin nya buatan teman saya . jadi kingkong keren dan tempat nya melabrak desain makanan cepat saji yang sudah biasa ada .
0	renyah , legit , enak dan porsi nya tepat , tidak terlalu besar dan tidak terlalu sedikit . menyisakan rasa enak meski sudah pulang kerumah . sangat disarankan bagi pecinta daging domba .
0	batagor kingsley batagor paling enak di bandung . apalagi kuah nya yang sangat lembut dan hangat . seporsi tidak cukup , perlu dua porsi . rasa ikan nya sangat kuat dan cukup mengenyangkan sebagai menu utama makan siang , jadi tidak masuk kategori cemilan .
0	rumah makan yang nyaman lumayan enak , saya mencoba soto rawon nya cukup enak dihidangkan di atas api kecil jadi hangat terus . sayang di sana banyak kolam tapi tanpa ada ikan . bayangkan saja kalau ada ikan koi pasti lebih asik . harga ya sekelas makan di mal .
0	the kios itu isi nya macam-macam stall dengan nama ternama yang dikumpulkan jadi satu , yang biasa dimakan sih nasi liwet atau sate tempat nya di braga remang-remang dan banyak nyamuk jadi nya , coba diterangkan dikit tidak usah remang-remang lampu nya makanan standar saja rasanya , mahal iya = d
2	wah . ini bilang nya si mendukung jokowi . tapi malah nantinya menusuk jokowi dari belakang .
2	inti nya . saya rela dan mampu beli bunga 100x pun . tetapi saya tidak sudi 1 rupiah pun buat sumbangan
2	awal nya saya sangat penasaran dengan kopi progo setelah membaca ulasan tentang kafe ini di sebuah blog . namun , setelah ke sana , kondisi nya menurut saya tidak sekeren yang diceritakan di blog tersebut . saya lupa nama blog nya apa . kursi-kursi nya nyaman sih , tetapi langit-langit nya yang rendah membuat ruangan terasa pengap . belum lagi sound system yang kurang bagus .
0	berlokasi di jalan . braga yang ramai , kiosk bagai oase di tengah kota . restaurant nya nyaman , banyak pohon-pohon , pelayanan baik , menu nya yang tradisional jajanan indonesia juga bervariasi . harga yang ditawarkan juga sangat terjangkau . menu yang patut dicoba adalah siomai tahu gejrot nya . hanya saja kadang kualitas makanan tidak standar rasa kadang bisa berbeda2 dari cabang kiosk lainnya .
0	ikan mas dihidangkan dalam olah pepes , yakni dibungkus daun pisang setelah dilengkapi rempah-rempah dan dikukus . dinikmati saat panas menambah selera makan
0	di bandung rumah makan yamien ada banyak . akang salah satu yang enak dan bisa di jadikan langganan . isi nya lengkap : babat , usus , didieh / marus , bakso , dan pangsit . masakan lain seperti capcay , mi goreng , puyung hai , dan lain-lain juga enak .
0	dusun bambu berlokasi di area lembang dan cukup mudah dijangkau dari kota bandung . di sini terdapat berbagai aktraksi dan aktivitas untuk anak-anak . selain itu terdapat foodcourt dan restoran yang menyediakan berbagai hidangan indonesia .
0	pemandangan di sini sangat luar biasa . udara sejuk nyaman . pilihan makanan dan rasa makanan sangat beragam . tempat yang sangat nyaman . betah sekali untuk berlama-lama di sini . saya rasa ini adalah salah satu terbaik restoran yang ada di bandung . bahkan indonesia .
0	halo kali ini saya akan mencoba mencicipi makan di bebek garang jalan braga , bandung , west java , indonesia . suasana restoran nya cukup nyaman , pelayanan nya sangat baik , dan makanan nya sangat enak dan lezat sekali . sambal nya mantap sekali pedas nya , nikmat . saya sangat merekomendasikan untuk mencoba makan di bebek garang ini , harga terjangkau . mari selamat makan bebek garang .
0	pas masuk , suasana nya nyaman banget . ruangan nya tidak besar , tapi di tengah dibuat taman kecil begitu . jadi asri deh . aku ke sini pas jam sarapan pagi , jadi menu nya itu menu khusus sarapan . pesanan aku roti bakar smoked beef keju , roti nya agak chewy , isi smoked beef dan keju nya cukup banyak . enak ! ig :
2	tidak keren
0	kawasan cipaganti bagi wisatawan luar negeri khusus nya dari belanda pasti menggenal kawasan cipaganti sejak dulu . dikawasan ini ada tempat makan yang sangat terkenal yaitu ayam goreng suharti . ketika masuk telah disambut dengan senyuman dari para pelayan yang chantik juga ada alunan musik tradisional . kemudian ketika menunggu pesanan ada sajian makanan yang disebut otak-otak yang sangat enak .
0	kalau soal rasa , jangan ditanya lagi . siomay atau pun siomay goreng nya adalah favorit saya . tempat penjualan nya diutamakan untuk yang membawa pulang tak awal . kalau untuk oleh-oleh bolehlah batagor kingsley menjadi pilihan . satu buah siomay nya tidak bisa dikatakan murah , tapi makan satu saja sudah cukup kenyang . kalau lagi lapar , dua saja cukup .
2	penasaran karena kata nya lagi hits banget . saya datang ke cabang yang di jalan dipatiukur bandung kira-kira jam 11 malam tanggal 3 september 2016 . karena kata nya buka sampai jam 2 pagi . tempat nya lumayan besar , parkir cukup luas , ada pilihan meja di luar , di non-smoking , dan lantai atas . mungkin karena malam minggu tempat nya ramai , sampai harus daftar tunggu . tapi saya kecewa karena waiting nya tidak jelas .
2	cemburu itu tidak enak . cemburu itu makan hati . cemburu itu cie . cemburu itu hmmm . cemburu itu oh . cemburu itu sakit , kalau tidak di ungkapkan
0	nyaman , bersih , makanan yang enak , dan sejuk ! saung-saung yang nyaman lengkap dengan bantal dan guling , suara air mengalir juga alunan musik sunda . selain tempat dan makanan yang enak , yang berkesan dari tempat ini adalah petugas toilet yang sangat ramah . :
2	mahasiswa jangan sok-sokan deh ikut politik . belajar sana saja deh .
2	cerahkanlah orang-orang yang pikiran nya sempit ini . kesal ih baca nya
0	restoran ini berada di sebuah kompleks perumahan cukup mewah , ke selatan dari terminal leuwi panjang , tempat dan suasana untuk makan di sana cukup bagus , terjangkau , menu makanan kebanyakan makanan barat , tapi ada juga masakan indonesia .
1	ledakan dalam aksi protes di afghanistan tewaskan 68 orang
2	itu dia maka dari itu gua yakin 100 % kalau kristen sekarang itu sesat , kitab perjanjian baru itu direvisi dari manusia-manusia , pikir saja kitab suci tapi direvisi sama manusia
2	prabowo sekarang miskin , bukti nya galang dana buat bisnis nya , ingin ketawa saya lihat bapak
2	semoga jadi pelajaran bagi rakyat indonesia untuk tidak salah memilih presiden di 2019 . menyesal banget pilih jokowi !
0	apresiasi
0	tidak menyesal deh pakai bagus skin care hasil terpampang nyata tanpa bedak tanpa menguras :
0	tempat yang bagus kalau dinikmati malam hari . cukup nyaman . harga cukup terjangkau . favorit saya steak tenderloin nya . cukup enak .
0	banyak ragam masakan sunda yang menggugah selera makan , nasi liwet dan sambel nya yang enak : penyajian nya pun sangat tradisional menggunakan piring dan gelas kaleng .
0	entah kenapa tidak bisa berpindah dari xiaomi , saya suka bisa layar capture 3 jari itu
2	parah pesan bukalapak pakai gosend kemarin sampai sekarang belum sampai bagaimana ini . barang nya butuh sekali
0	ingin kuliner tahu yang enak di sini tempat nya , kata saudara yang tinggal di bandung . ternyata ya sih enak juga . hanya piring dan sendok nya tidak seperti biasanya . dan harga nya tidak mahal murah banget rasa tahu nya khas sekali enak . okelah mau pulang bungkus .
0	teh dengan aroma dan rasa yang berbeda2 sangat nikmat untuk menemani istirahat . saya mampir ke gerai walini ini untuk menikmati teh di tempat dan juga membeli beberapa paket untuk dibawa pulang . memang aroma nya berbeda dengan yang lain .
0	kebetulan sedang liburan tahun baru dengan kawan-kawan di bandung . ingin makan steak , dan kita tetap cari abuba . welldone steak plus sayuran yang banyak jadi andalan . menyesal kalau belum pernah coba .
2	admin permasalahan saya itu pada registrasi ulang , kenapa malah jawaban nya on off kan data , tidak jelas !
0	jangan kecewa dengan jawaban yang tuhan beri
0	steak sebenar-benar nya steak especially chiken cordon bule nya yang bikin kangen plus makan yang diselimuti pemandangan bandung yang top markotop . pas banget datang nya malam ya dengan pasangan bagaimana pun dengan keluarga juga tetap asyik . jalan menuju ke lokasi memang berli ku perlu usaha dan kerja keras .
0	setiap kali ke bandung bersama keluarga , selalu menyempatkan waktu untuk menikmati makan malam di kampung daun - lembang . selain bisa menikmati makan malam , kita juga bisa menikmati suasana alam yang asri dan sejuk bersama keluarga .
0	awal nya saya tidak berekspektasi apa apa tentang mih kocok ini . saya pikir rasanya biasa saja , tapi ternyata rasanya enak banget . saya direkomendasikan memesan mih kocok dan sumsum sapi . istimewa nya di sini , sumsum sapi tidak dihidangkan dalam bentuk tulang dan sedotan , tapi sudah dipotong potong besar dan sekilas terlihat seperti gaji . kaldu nya berasa banget , isi nya mi , tauge dan potongan kikil ditaburi .
0	untuk pertama kalinya kami mencoba makan malam di restoran yang kata nya dicari cari karena sejarah nya ternyata dihari biasapun restoran ini sangat padat pengunjung . pilihan menu sangat variatif : mulai dari italian , mexican , indonesian , dan lain-lain kami mencoba order pizza yang super enak , lasagna lezat dan mengenyangkan , mi goreng kepiting porsi besar dan enak , lidah beef tongue - 2 potong dengan rasa yang pas di lidah .
0	tidak benci
2	megawati mah tidak ada apa-apa nya
0	makanan murah . untuk harga yang ditawarkan sih ya rata-rata begini makana nya . hanya pelayanan harus ditingkatkan karena cenderung lambat .
1	kpk habiskan rp 780,1 milyar pada 2017
1	nyinyiri pembangunan infrastruktur pemerintahan jokowi , fadli zon : kata nya revolusi mental
1	masih belum bisa paket yellow nya minimal
0	fasilitas tempat bermain anak , meski terbatas . nasi bakar tuna nya endus pedas dan sangat terasa bumbu serta menyatu . harga so-so .
2	mengurusi bendera mulu nih tentara banci . yang bakar bendera di papua berani tidak . kalian cuma nampak hebat kalau pakai senjata .
0	kopi anjis merupakan tempat gaul nya anak bandung . sajian bermacam kopi yang menarik . saya waktu di anjis menikmati kopi nutela khas anjis , dan rasanya sangat mantap . di anjis juga tersedia bermacam pilihan minuman dan makanan . yang paling mencolok di anjis yaitu sangat ramai nya anak gaul bandung yang nongkrong di sini .
0	restoran indonesia yang bertempat di lembah di sekitar sersan bajuri ini menyajikan hidangan khas sunda mayoritas menu dan tempat yang asri . terdapat sungai kecil yang menambah suasana alam . terdapat juga jalanan pasar tempo dulu .
0	saya mencoba spicy prawn . menu ini berupa nasi bakar dengan bumbu tom yam dan telur telur nya bisa pilih mata sapi atau dadar . saya coba dengan telur dadar . nasi bakar nya enak . rasanya asam pedas . bumbu nya cukup terasa . cocok buat makan siang . suasana resto juga enak . cocok untuk keluarga . harga nya tidak mahal dan pas dengan kantong mahasiswa .
2	kata nya si jika dipilih bakal memberantaskan korupsi di indonesia . ini malah korupsi . dasar say .
2	kasihan ya pak nyalon terus tapi kalah melulu . ya iya bapak kan kurang kompeten buat negara ini .
0	setiap seluruh keluarga kumpul biasanya kami memang pilih ampera . selain cabang nya banyak di mana-mana . lesehan nya banyak . pilihan makanan sunda nya banyak serta sambal nya huhuy super ! kadang kalau beruntung , dibeberapa cabang tersedia gazebo dan playground nya .
0	saya mencoba suis butcher di selai di suis butcehr di stiabudhi , saya juga mencoba suis butcher di jalan . riau . saya lebih menyukai suasanan di suis butcher di setiabudi yang tidak terlalu ramai , dan enak tempat nya buat ngobrol . makanan nya saya suka tenderloin , salad , frencfries , dan tiramisu nya . harga dan rasa sebanding kok , so setimpal sekali pelayanan nya juga lumayan cepat .
0	mi salah satu makanan kesukaan saya . tiap mau makan mi selalu pergi ke sini . mie nya enak , lembut , berasa . untuk bakso goreng nya juga enak , garing , udang nya berasa . tempat nya sering ramai . kadang suka mengantre juga . untuk harga standar dengan rumah makan lain . patut dicoba kalau ke bandung .
2	kalau suka seafood , terutama kepiting , jangan lupa coba tempat seafood yang 1 . rasanya enak . harga nya juga terjangkau tidak terlalu mahal untuk ukuran harga seafood . hanya 1 yang sayang seribu sayang . poor pelayanan . buat pelanggan yang pertama mencoba ke tempat ini , saran saya , sebaiknya order 1x , jangan mikir nanti saja tambah kalau kurang , karena susah dipesankan lagi .
2	konyol banget ini ketua bek . jadi dasar dia itu cuma dari baca ?
0	kita menangkan indonesia dan menjadikan awas pertama di tahun 2018
2	kotor banget dan tidak di hiraukan oleh pelayan restoran blok m square . mengecewakan sekali pelayanan nya !
0	lokasi ini memang salah satu jagoan nya masakan sunda , yang enak dan termasuk terjangkau harga nya . namun untuk pengelola nya , harus lebih perhatikan lagi , kualitas kebersihan dan kualitas rasa masakan nya yang kadang suka gosong . suasana pedesaan dan pesawahan dengan padi yang sengaja ditanam memberi kesejukan tersendiri .
2	marah marah sendiri itu melelahkan .
0	tempat nya nyaman untuk ngobrol sama teman . kue-kue nya enak . lalu ada juga makanan penutup yang isi nya es serut , dan bubble , rasanya enak .
2	demiz suka-suka - an jadi kader demokrat , tidak cocok
0	cocok menjadi keluarga restoran . menjadi opsi dari berbagai kafe yang ada di seputaran jalan . progo , giggle box akhirnya menjadi pilihan kami karena jam buka yang lebih malam dibanding kafe di sekitar nya .
2	ratakan saja bali dengan tanah
0	sejak pertama buka , aku suka banget sama aneka kreasi tahu mereka . favorit aku itu tahu buntel sama tahu pletok . selain menu tahu , ada menu-menu makanan indonesia lainnya kok yang enak-enak . interior nya juga bagus , bersuasana warung .
2	pelayanan sangat lambat ! semua pelayan di panggil-panggil tapi pura pura tidak lihat dan tidak dengar ! seolah masa bodoh . makan dan minum datang setelah berjam jam . mahal yang tidak masuk akal . menjengkelkan . pengalaman terburuk . niat ke sana mau menyegarkan malah kesal sama pelayan2 nya . pertama dan terakhir deh . not rekomendasi tempat
0	bagus . alam sekali makanan oke rasa biasa cuma agak pricey kalau malam lebih remang-remang dingin utan sekali tempat wajib kalau ke bandung nih
0	prefer traveloka daripada airy , alasan nya karena traveloka lebihm murah dan lengkap ahahha
0	bebek garing nya enak . digoreng kering tanpa tepung . tidak ada bau amis bebek sama sekali . apalagi dimakan sama sambal matah . saya pilih dimakan dengan nasi merah . enak banget . harga nya lumayan mahal . namun sebanding dengan rasanya .
0	tempat yang menyenangkan untuk berkumpul bersama teman-teman atau pasangan . makanan dan minuman yang disediakan variatif dengan harga yang cukup terjangkau
0	lokasi nya yang terletak di pusat kota bandung dan dekat dengan beberapa universitas , menjadikan tempat ini selalu ramai tiap malam dan akhir pekan . dengan akses wi - fi dan dilengkapi juga dengan nonton bareng nobar sepak bola menjadikan kita betah untuk nongkrong lama di tempat ini . nasi marah dan susu cokelat nya sangat mantap . waroeng bandoeng ini buka sampai dini hari .
0	suasana yang nyaman , asri dengan pelayanan yang bagus makanan yang pas tidak menyesal deh ke kampung daun , serasa ingin mengulang lagi ke sana , tempat yang bisa dikatakan untuk istirahat dikala sedang perjalanan atau bisa juga untuk tempat menenangkan pikiran dan bisa buat tempat romantis juga karena suasana nya dingin sekali , top markotop deh
0	saya suka makan di sni . variatif makanan nya . bukan hanya lo mi ya . ada empek-empek . makanan sunda . batagor . siomay . clemons . dll. favorit saya adalah siomay / batagor nya . di sini . rasa makanan nya enak-enak dan harga nya terjangkau . kita jadi kenyang dan tidak bikin kantong bolong . hhe
2	waktu itu beli beef brisket schnitzel dan rasanya biasa . tempat nya oke , kurang nyaman karena selesai makan , piring nya cepat sekali diambil untuk dibereskan .
0	anw indomie pertama di 2018 ku semalam ternyata nikmat
0	lebih seru malam hari karena ada lampu-lampu obor . di sana banyak jajanan kampung seperti mengingatkan masa kecil yang sudah besar ya . dan untuk restoran nya sangat nyaman karena masing-masing gubuk . jadi sangat pribadi . dan di sana ada sungai dengan suara air yang menambah nyaman , malah lebih enakan buat istirahat daripada makan nya . hehehe . keren deh
0	janjian sama teman lama di temoat yang satu ini cukup menyenangkan . tempat nya nyaman , santai , tenang , dan makanan nya lumayan enak . pelayanan nya ramah dan cepat
0	ketagihan makan di sini , cah kangkung nya enak , pelayanan nya bagus , ramah , tempat nya juga sangat nyaman dan strategis , berada di pusat kota bandung , dekat dengan swalayan dan hotel , dan dekat dengan pintu tol pasteur , jadi untuk yang di luar kota , bisa dengan mudah menemukan tempat ini
0	ketika menghadiri suatu acara keluarga yang bertempat di le marly maka yang terpikir ialah pantry yang khas dengan menu yang khas pula . ternyata dugaan saya benar , menu yang ditawarkan oke banget berbanding lurus dengan harga nya : demikian pula minuman nya . namun karena malam minggu sehingga waktu tunggu sejak memesan sampai makanan datang membutuhkan waktu lebih dari 30 menit . sebetulnya bukan problem . lanjutan
2	barang nya oke , cuma yang saya heran xiaomi redmi note 2 ini tombol on nya memang agak rusak ? terus baterai memang cepat low bat juragan ?
0	menurut saya lumayan , tapi sambal nya kurang pedas , di sini enak suasana nya saja karena udara yang sejuk , untuk rasa makanan menurut saya biasa saja , lokasi nya pinggir jalan utama memudahkan untuk di akses
0	berlokasi di bandung utara , tempat makan yang asik dengan suasana yang asri . makanan cukup bervariasi sayang kurang enak , harga agak mahal , pelayanan agak lama mungkin karena penuh pengunjung dan tempat yang cukup luas , sehingga kami cukup lama menunggu pesanan . kelebihan tempat ini hanya lokasi saja
2	iya nih . kok maksa betul sih , emang nya siap kecewa kalau ulama kesayangan kita semua itu nanti ternyata mengecewakan saat jadi wapres ? politik saat ini kotor kejam gaes . belon waktu nya ulama berpolitik .
0	tidak sengaja dapat makanan rumah makan otentik di daerah braga yang lebih didominasi bar kafe . puas sekali rasanya bisa makan makanan seperti ini saat liburan di bandung .
1	cuci tangan pakai sunlight , stelah itu pakai sabun zwitsal
2	tidak inspirasi
2	dulu dari tempat yang sama , gayus tambunan bisa bebas berkeliaran ke luar negeri . kita tentu tidak ingin jika ahok menjadi gayus selanjutnya , bukan .
0	resto yang berada di dago pakar atas ini memiliki pemandangan yang sangat indah . ketika malam dapat melihat cahaya kota bandung dari ketinggian . makanan utama yang ditawarkan adalah set menu lengkap . harga nya cukup mahal untuk set menu dengan rentang di atas 100 ribu . average 150 ribu - 200 ribu untuk complete makan malam .
2	saya makan pagi di restoran lantai 18 ini dan kebetulan saya mendapatkan tempat duduk di luar atau balkon . bantalan tempat duduk nya terlihat banyak noda kotoran . angin sangat kencang bertiup sehingga makan pagi tidak nyaman . saya sarankan apabila anda makan di restoran ini , pilih tempat duduk di dalam untuk kenyamanan .
2	mas indosat buat main game enemy has been selain susah benar mas tolong sinyal nya diperbaiki mas karena lambat tidak lambat kuota nya tersedot terus .
0	tidak rusak
2	pantesan prabowo kalah voting . lah pendukung nya cuma punya 2 follower . bagaimana mau promo .
2	harga yang tidak masuk akal , iga nya hanya sedikit daging nya , kebesaran tulang . sambal tidak pedas . lama responses pelayanan . not layak at all
1	kapan pun di mana pun sahabat bisa berdonasi melalui
2	om . kamu kafir ya ? monti belum sunat dong .
0	kafe ini buka dari waktu sarapan . tapi biasanya kalau ke sini malam . menu nya cukup variatif dari cemilan ringan kayak pisang goreng . bakso tahu sampai makan berat . nah biasanya sih kalau ke sini buat makan berat karena yang dicari sop buntut bakar atau iga bakar nya . enak rasanya dan empuk , tidak bau . dimakan pakai sambal mangga rasanya segede rasa dan sudah pasti kenyang nya karena porsi nya cukup besar buat ku .
1	guna nya shazam : biar tahu lagu-lagu ajaib yang diputer sopir gocar
0	kafe ini sudah ada sejak zaman dulu , yang favorit adalah aneka sosis nya . favorit saya blackpepper sausage . disajikan dengan kentang goreng .
0	mencari yang semua rasa coklat , ke toko coklat saja . variasi coklat nya banyak dan tempat nya yang nyaman untuk nongkrong-nongkrong cantik .
0	pia ini sudah lama berproduksi di lembang . saya menyukai pia rasa kacang ijo nya , rasa lain yang tersedia : coklat nanas keju duren pelayanan memang agak lambat , cobalah bersabar karena pia ini terkenal dan industri rumahan . dengan rasa dan kualitas yang terjamin , saya rasa kesabaran anda akan terbayarkan .
0	lumayan banyak menu makanan yang ada di sini . harga nya pun lumayan murah untuk rasa yang enak . cocok untuk tempat kumpul makan bersama keluarga .
2	lama lama segel juga melihat militan nya demokrat . gerak nya gitu-gitu aja
0	rasa martabak cukup lezat , karena penjual pun royal untuk menaburi banyak keju dan minyak wijen . harga relatif murah . untuk martabak asin nya pun juga lezat . dan berasa lumer di mulut . saya rasa berhak untuk diacungi jempol . tempat nya pun unik seperti bentuk mobil mainan .
0	burung puyuh rawit nya enak banget . aku coba ini di daerah banda , kalau makan tidak cukup seporsi . rasanya manis pedas . cocok deh buat pecinta makanan .
0	resto nya bagus dan besar . waktu ke sini saat makan siang dan hari minggu ramai sekali pengunjung . makanan nya enak enak , gurame goreng dan sambal nya mantap .
0	kebaikan prabowo itudi rasakan oleh masyarakat indonesia
2	untuk apa kau sekolah tinggi-tinggi tapi ngomong macam anjing menggonggong .
0	pemandangan bagus , ada sungai kecil anak-anak bisa bermain , ada permainan air juga . makanan juga lumayan enak . harga standar restoran sejenis .
2	jangan pilih ahokodokers di pilkada 2018 , pileg dan pilpres 2019 . muslim bersatu , kita menang . seperti pilkada jakarta
1	begini gaya sby saat tunggu kelahiran cucu nya gaya sby presiden ke-6 republik indonesia saat menunggui kelahiran .
0	pertama kali menikmati mi naripan di kota bandung cukup berkesan bagi saya . mie nya enak dan potongan daging babi cincang nya juga gurih . apalagi ditambah dengan pangsit kuah nya yang lezat .
0	rasanya enak , kuah nya unik . sampai di sini harus antre karena ramai sekali . batagor nya juga enak .
2	sby juga cabut saja warga kehormatan nya ! lagipula sepak terjang sby ketika uji banding banyak penyelewengan nya di banding pengabdian nya !
