0	1 . pilihan masakan nya sunda tradisional banget 2 . alat makan sangat tradisional . bagi yang dahulu pernah makan dan minum dengan piring / gelas kaleng , yang ada gambar khas bunga-bunga atau seperti batik warna kehijauan , alat makan di sini seperti itu . 3 . murah banget . 4 . asik sepertinya buat nongkrong karena tersedia runtutan meja makan kecil dengan kursi cukup rendah , saya merasakan suasana tempat kumpul / nongkrong .
2	saya tahu mas kesal banget . mas fadlil memang salah tapi sampai bully personal lift nya di instagram dan facebook memang keterlaluan banget sih , bagaimana pun itu kan privasi dia . kecewa bikin konten kritis di tapi ternyata main persekusi begini .
0	pemandangan nya bagus . jangan lupa menyiapkan kamera kalau ke sini . pas kalau datang nya malam . pelayan nya juga lumayan ramah
0	tempat makan yang unik dan bergaya zaman dulu , makanan standar saja , pelayanan nya sangat bagus dan ramah
2	bagi para pendukung nya , jokowi mungkin seperti robin hood . tak masalah bila jokowi korupsi , tak masalah melanggar aturan tender untuk kesejahteraan rakyat . tak mengapa berbuat kriminal , asal tujuan nya membela rakyat . apakah anda setuju dengan konsep robin hood ? helo . ke mana pikiran mereka ?
2	kebodohan yang begitu jelas . kapan bisa menikmati hiburan berkualitas kalau hasil produk nya kayak kamu
2	sudah mbak percuma juga tidak bakal dijawab .
0	menu nya memang standar namun kelebihan nya adalah suasana yang ditawarkan , begitu nyaman dan cocok untuk makan bareng teman-teman sambil mengobrol menikmati keramaian di pvj
2	ayo kita bantu viralkan . tindakan semena-mena pejabat .
0	salah satu ciri khas dari verde resto adalah menu pizza nya . yang menarik adalaha pizza rainbow dan pizza volcano . ketika saya berkunjung ke sini , saya dan teman-teman memesan pizza volcano . proses penyajian nya unik . saat pesanan diantarkan ke meja , pramusaji sudah membawa secangkir cairan untuk membakar pizza tersebut . dan voila . seluruh permukaan pizza pun menggembung terbakar dan diselimuti api . menurut kami itu sangat menarik .
0	rendang itu masuk daftar makanan terenak di dunia . mantap .
0	hari begini kok suka yang ribet , tinggal datang dan nikmati suasa alam dan pemandangan yang luas biasa bikin betah deh dijamin hampir setiap 3 minggu saya pulang ke bandung pasti mampir di kampung daun yang bikin balik dan rutin dan penikmat makanan dijamin ke boring dan dosen , belum lagi makanan yang enak terutama nasi bakar , dan ikan goreng .
1	10 peserta terbaik akan melaju ke babak final .
0	nasi uduk di sini rasanya sangat enak . apalagi dengan bawang goreng yang banyak . super nikmat . sambal nya juga enak . harga sangat terjangkau . pelayanan standar saja . rekomendasi !
0	akhir tahun 2015 saya makan bersama keluarga di braga permai ini . di antara keluarga cuma saya yang baru pertama kali ke resto ini . menurut saya makanan nya enak dan porsi nya sangat banyak . buat saya satu menu bisa untuk 2 orang . nasi satu porsi juga isi nya banyak . harga nya pun tidak semahal yang saya kira , harga nya sesuai dengan porsi makanan yanh banyak dan besar .
2	gaduh nih daki kecoa bacot melulu , bangun woi jangan menghina melulu kampang .
2	benar-benar ancur negara aing . kabar dari cianjur selatan , para anjing-anjing yang pura-pura gila sudah sampai tanggeung cianjur selatan . dia berencana membunuh ulama tanggeung kiayi h din din tapi alhamdulillah bisa ditangkap .
2	inilah pimpinan hasil olahan iblis yang tidak pernah kita sadari , kasihan negri ini . !
0	tempat makan yang lumayan strategis , lokasi nya tepat di seberang taman pramuka atau ex hitam pasar . pas ke sana pas jam makan malam jadi nya penuh , tapi pelayan nya ramah memberitahu kalau tempat makan penuh sehingga diminta menunggu sebentar . secara umum rasanya enak , pilihan udon dan aneka tempura nya juga banyak . tempat duduk nya juga ada pilihan merokok dan non merokok .
0	cocok buat ngadem , makan siang diiringi lagu sunda , sambil menikmati pemandangan sawah dan kolam ikan di bawah saung makan
0	sudah terhitung lebih dari sepuluh tahun saya selalu menikmati sioamay dan batagor setiap kali berkunjung ke bandung . dari harga masih dua ribu lima ratus sebuah nya . kingsley hanya menyediakan 3 macam menu yaitu mi , siomay dan batagor . untuk mie nya , rasa standarlah , cukup enak . favorit saya adalah mi yamin manis pangsit . camilan batagor dan siomay , saya lebih suka siomay nya karena rasa ikan nya kuat .
0	keunggulan holycow dibanding resto steak lain adalah wagyu nya yang mantap . favorit saya adalah wagyu sirloin steak yang dinikmati dengan mushroom sauce . rasanya mantap . daging nya tebal dan dinikmati dengan butiran jagung rebus , sayur bayam dan masih potatto . enak dan mantap .
0	wah . kurang lengkap rasanya jika ke kota bandung untuk tidak mampir ke tempat ini di malam hari . dengan tagline 1001 tempat makan , tempat ini layak dijadikan pilihan untuk bersantap malam bersama keluarga dengan pilihan yang super banyak .
0	menurut saya , the valley , tempat paling romantis se - bandung . pemandangannay spektakuler waktu sore hari menuju malam , mantap dah buat makan malam bareng teman , keluarga , atau sama kekasih tercinta . pemandangan nya menghadap gunung dan kita bisa mengutip kota di bawah nya , ditambah pencahayaan di di luar maupun dalam ruangan nya , merasa seperti lagi dibegitu . pokok nya kalau ke bandung , super direkomendasikan la .
0	pertama coba dan langsung suka ! waktu itu pesan bakmi komplet . enak banget . mie nya kenyal . tidak terlalu kecil , tidak terlalu besar . porsi nya besar , daging nya juga banyak , ada jamur nya juga . harga terjangkau sesuai porsi .
2	layar rada kuning ya . selebihnya standar
2	bandung suki restoran ini sudah tak enak lagi . beda sejak pertama buka , tamu berjubel harus tunggu , kebagian meja , sekarang kosong melompong , makananan rasanya sudah tak enak lagi , saya tidak terpaksa tidak ke sini .
2	4 tidak nya tidak bisa diterima hanya h , payah
0	saya senang berlama-lama di sini , karena suasana nya enak , pencahayaan nya bagus , ada pilihan bisa di luar ruangan atau di dalam . makanan nya lumayan
0	makanan seperti biasa enak relatif sih tergantung menu , suasana sangat nyaman , cuma satu hal yang saya rasa agak ganjil dalam daftar menu tercantum es jeruk cuma tidak ada harga nya saya fikir harga pada umum nya es jeruk di kisaran 7000 - 12000 tahu nya di bill dan setelah di cek setelah bayar harga nya 25 ribu , tidak masalah sih asal tercantum di daftar menu .
0	terletak di paskal hyper square dekat stasiun bandung , makanan pasar ini akan semakin ramai pengunjung saat malam hari dan akhir pekan . pilihan makan nya cukup lengkap . harga nya pun terjangkau . terkadang , ada live musik juga , sehingga menambah keistimewaan tempat ini dibanding makanan pasar lainnya .
0	bakmi nya enak , pangsit kuah dan goreng nya juga enak harga nya cukup terjangkau , pelayanan nya ramah dan cukup cepat
0	dusun bambu tempat yang cocok untuk kumpul jauh dari keramaian kota . sejauh ini tempat cukup bagus dan tata ruang nya juga bagus . tapi yang sangat kami sayang kan , saya dan teman teman tidak bisa menikmati makan siang kami di fine dinning yang berada tepat seberang danau . dan juga di pasar khatulistiwa terlalu ramai dan kami anggap kurang nyaman .
0	tempat indah makanan . bolehlah . petugas sigap dan ramah dicoba kambing ala korea nya juara buat penutup colenak nya juga enak sekali tetapi tempat nya betul-betul indah bandung memang surga nya indonesia
0	hanamasa sudah ada sejak zaman saya kuliah letak nya waktu itu di depan bip jalan merdeka , ala kamu bisa makan ambil sendiri , masak sendiri , mantap rasanya .
2	tempat nya ramai banget dan penuh . saya dan kawan-kawan sempat masuk daftar tunggu 45 menit . pedas nya ada beberapa level yang terendah level nol itu menenangka dan yang teratas level 4 itu mematikan cukup unik . bagi saya rasanya biasa aja karena tidak terlalu spesial . minuman nya juga biasa tidak terlalu banyak varian .
0	letak nya di pujasera merdeka , seberang mal paling tua di bandung cip seperti pujasera lainnya , agak ramai tidak seperti foodcourt yang ada di mal . segala macam minuman ada di sini , wajib dicoba !
0	sebelum saya dan pasangan pulang ke jakarta . saya mampir dahulu ke kampung daun ini . pemandangan nya keren dan makanan nya pun murah meriah . rekomendasi sekali
0	setiap kali ke tempat ini selalu saja ramai pengunjung nya , karena bakmi di sini enak dan murah , tempat nya juga strategis , berada di jalan utama kebon jati
2	indonesia bubar ? partai kamu saja yang bubar ! partai tidak berguna untuk indonesia .
0	ini adalah outlet makanan jepang yang baru di gedung baru bec bandung . lokasi nya berada di lantai lower ground lagi istana bec jalan . purnawarman bandung . yang kata nya enak di sini adalah rice bowl , untuk itu saya kemudian mencoba memesan yakini ku beef bowl yang large . mangkuk besar berisi nasi yang terasa banyak dan mengenyangkan .
0	saya sangat terkesan dengan masakan yang ada di restoran raja sunda bandung . rasanya sangat khas sunda dan mantap . sambel nya enak , sayur asem nya juga enak . saya cukup merekomendasikan paket nasi timbel spesial
0	meskipun kuliner baru menjamur di bandung tetapi bakmi naripan merekan pilihan tersendiri buat saya . cita rasa klasik dan terjaga kebersihan nya . keep the rasa .
2	fpi anjing babi . kamu pantas di musnahkan . fpi bukan islam , tapi dajjal bangsat . jangan bawa-bawa islam buat kebohongan lu . bangsat
1	memasang foto editan rizieq pakai topi santa claus , ade armando dipolisikan
0	restoran ini menyajikan masakan bali yang sarat modifikasi sehingga terkesan disesuaikan dengan lidah konsumen yang nota bene bukan orang bali . tiga photo yang saya lampirkan itu adalah makanan yang kami pesan .
1	sinergi bni - kementan - tni penyaluran kartu dan kur tani menuju ketahanan pangan nkri . hilangkan sistem ijon , perangi rentenir , lindungi petani .
2	yang punya ladang uang diremang-remang kena sweeping fpi ya . kasihan deh tidak bisa jualan lagi .
0	saya dan keluarga sangat senang bisa berkunjung ke dusun bambu . view nya sangat bagus dengan pemandangan alam yaitu taman , sungai buatan , dan bukit-bukit . tempat nya sangat luas , ada tempat bermain untuk anak-anak dan area makan nya juga banyak . meskipun harga-harga makanan nya agak mahal , tapi sebandinglah dengan pemandangan yang diberikan . ada jembatan panjang , ada danau buatan , sungai buatan dengan air yang mengalir , dan taman bunga yang cantik .
2	aku ingin marah sama sinyal nya indosat inilah sumpah
2	bakar hidup hidup saja itu para homo
1	tenggak miras oplosan , dua pelajar di tasikmalaya tewas
1	saat menteri susi diserang jusuf kalla dan luhut , gus mus tampil membela
0	homy banget suasana nya . makanan nya banyak banget ragam nya . menyenengil melihat nya . yang paling top memang tahu gejrot , paru sama burung puyuh nya . harus dicoba menu .
1	pengamat : ada pergeseran politik nasional melihat hasil pilkada 2018
1	yang liburan dirumah bocoran internet bisa buat streaming youtube , nontonin film-film , atau kayak kakek netflix - an the flash semua session
0	kwetiau goreng jadi favorit saya di sini disajikan dengan telur mata sapi , porsi jumbo cukup mengenyangkan , minuman favorit cobalah es teh tarik . enak banget .
0	saya makan di batagor siomay kingsley di bandung pada senin , 01 jun 2015 . tidak hanya menjual batagor dan siomay , namun juga tahu yun yi , kue cubit , ronde jahe , maupun aneka macam minuman teh hijau . juga ada roti panggang maupun bakmie . saya pesan batagor goreng dan roti panggang . rasanya enak , dan pengunjung nya juga ramai .
2	sama , saya juga muslim ogah banget dibela fpi , cabul gaya preman , tidak mencerminkan seorang muslim
0	salah satu kafe yang mengusung tema shabby . menyenangkan baik untuk yang sudah berkeluarga ataupun pasangan . ada menu spesial di sini yang cukup menarik . disarankan anda membawa beberapa teman untuk membantu anda menghabiskan nya . justru disitulah keseruan terjadi . yup cobalah menu burger hitam super besar kira-kira berdiameter 16 cm .
0	kalau dari luar , kelihatannya tempat ini kecil tapi ternyata setelah di dalem . tempat nya luas . apalagi di bagian belakang , luas dan nyaman sehingga bisa makan dan kongkow-kongkow dengan santai . makanan nya enak , pelayanan nya ramah . tak heran jika pengunjung nya selalu banyak . oke banget .
0	tempat nya cukup luas dan memperbolehkan tamu merokok di dalam . waktu datang ke sini , karena sudah malam kami hanya pesan minuman dan makanan ringan . minuman yang disajikan cukup variatif , musik yang diputar juga tidak terlalu bising sehingga masih nyaman untuk mengobrol di situ .
2	pengiriman lambat , 2 hari baru dikirim setelah pembayaran di verifikasi tokopedia . windows yang dimemasang bin 10 pro bukan original .
0	the vallley ! resto romantis yang oke banget . waktu itu saya diajak pasangan saya untuk celebrate anniversarry kami . jadi romantis , menikmatin makan malam dengan pemandangan kota bandung , cuaca kota bandung yang segar dan dengan lilin kecil yang dimenyalakan di setiap meja . tidak hanya tempat nya yang oke , tapi makanan nya juga oke banget di lidah . pilihan makanan nya banyak .
0	menu nya makanan barat , seperti steak , dll. enak banget , sebanding sama harga nya yang tinggi . waitress nya agak kurang responsif tapi ramah kok . lebih asik makan di di luar area , bisa melihat kota bandung dari atas , terus kalau malam romantis . oh iya , sempat bertemu artis lho saya dion wiyoko . haha .
0	tempat nya ada indoor dan semi di luar , udara sejuk , menu beragam , porsi nya besar , harga nya pun relatif murah dengan rasa porsi yang cukup memuaskan . pelayanan nya pun oke . rekomendasi banget deh !
0	ini nasi goreng yang tidak mainstream . zaman sekarang rasa nasi goreng di mana sama , tapi ini beda . kerasa banget rempah rempaha nya . dengan level pedas yang bisa dipilih . dekat kampus juga
0	tempat di restaurant kampung daun ini sangat unik , dengan saung-saung dan jalan menuju saung nya berbukit . makan juga enak dan beragam tapi harga nya agak mahal dari standar restauran biasa mungkin karena tempat nya yang unik .
1	tni ada 57 orang ikuti binkom apintel / pam tni di kodam ii / sriwijaya
0	outlet rotiboy di bip berada di lantai dasar , tepat nya di samping outlet es teler 77 . konsep dapur terbuka , di mana konsumen dapat melihat langsung proses memasak roti nya , menjadi daya tarik sendiri bagi para konsumen yang lagi mengganti . gerai rotiboy di bip tidak terlalu besar dengan warna yang mendominasi adalah warna khas rotiboy yakni cokelat . menarik , asik , dan enak .
0	satu kata ketika saya ke tempat ini , awesome ! walaupun letak nya jauh dari kota bandung , tapi sesampai nya di lokasi ini , puas rasanya , pemandangan nya indah banget , suasana nya romantis banget . memasuki lokasi parkir , kita bisa melihat semacam tugu terbuat dari bambu yang menjulang tinggi . dari lokasi parkir , kita akan diantar dengan mobil menuju ke lokasi utama nya .
2	terindah , terindah , gerrrrobak prabowo mendingan pindah haha gih prabowo caw saja salah
0	jokowi tidak suka sebar isu bohong
2	berisik banget sih islam tolol ini , siang malam bahkan jam segini teriak-teriak dirumah setan . enggak capek apa kalian anjing , ganggu tidur orang saja .
0	untuk jenis makanan seafood , harga nya masih terbilang murah . meski porsi nya cenderung kecil , tapi rasanya enak . dan tidak terlalu lama menunggu pesanan datang .
1	gus mus bela dan doakan menteri susi pudjiastuti via
0	3 tahun dong makan siang di warteg inii terus . memang sempat bosan sama menu nya . tetapi ngangenikan juga ternyata . sekarang masih sering mampir untuk makan sop buntut atau soto babatnyaaa
0	lebih untung beli ori014 di bni , cashback 0,2 % untuk dana freshfund amp ; 0,05 % untuk non freshfund .
1	datangi kantor pdip , ridwan kamil berusaha gaet dukungan di pilgub jabar
0	wah akhirnya masuk tripadvisor juga mi jogja pak karso ini terletak di jalan abc ini sering dikunjungi oleh warga malaysia yang belanja ke pasarbaru menu nya tidak banyak mi godog rebus , mi goreng dan nasi goreng , selain itu juga ada menu ayam penyet yang pedas . menu jagoan ku sih mi godok , dimakan panas-panas dengan cuaca bandung yang dingin . mantap
0	lebih baik datang tidak di musim peak season , karena terasa riuh rendah belum lagi perjuangan mencapai tempat ini dari kemacetan di lembang . hari biasa , pengunjung tak terlalu banyak jadi tempat yang nyaman untuk merenung , meresapi keindahan alam . ada wahana bermain untuk anak-anak , ada tempat bersantap pribadi menghadap danau , lakukan dulu reservasi beberapa hari sebelumnya . bisa bersampan dengan orang yang kita sayang .
0	harga makanan di sini relatif cukup mahal , namun porsi yang ditawarkan memang besar , sehingga untuk 1 porsi makanan dapat berbagi dengan 2 orang . di restoran ini disediakan live musik dengan suasana yang ramai dan mayoritas dikunjungi keluarga atau bepergian dengan teman .
2	galau biar dikata apa ? biar dikira apa ? biar dia kasihan ? biar dia iba , __laugh__ buat mikirin lo saja dia tidak ada waktu
2	hai . hai . hai . jokowi si monyet kecil mau lari kabur kemana lu jokowi negara indonesia sudah dijual ke cina dan usa yang menjual kesepakatan bersama jokowi , megawati , sby , prabowo , para jendral masa gatot , tokoh batak melayu . wkwkw windface sparklingheart sparklingheart sparklingheart
0	luar biasa rasa ayam goreng nya . hati-hati karena anda bisa lupa anda sudah menghabiskan berapa potong ayam saking enak nya . menu lainnya bisa dijadikan alternatif
0	cobain deh masakan vegetarian , sehat dan juga banyak varian apalagi bawa keluarga harga tidak terlalu mahal
0	makanan nya enak . pelayanan nya memuaskan bersama mas agus . pemandangan malam hari pas hari ini tidak hujan , indah banget . hanya sedikit kecewa , skywalk nya sedang dalam perbaikan .
0	pesan bakmi ca sao dan bakmi rica rasanya enak banget dan harga juga oke 32.000 / porsi nya . bagi yang tidak suka pedas jangan memesan bakmi rica karena pedas banget . kalau saya sih suka . selamat mencoba .
1	mantan dirut asap faik fahmi diberikan jabatan sebagai dirut angkasa pura i
0	berkesempatan menikmati santap pagi dikarenakan sedang menginap di hotel padma bandung . sebagai pengunjung baru seperti saya dan mungkin yang lainnya barangkali akan antusias terhadap suasana santap pagi yang diwarnai dengan pemandangan dari sisi timur , karena dari sisi tersebut terdapat keindahan bangunan hotel berikut kolam renang - nya , selain itu juga terdapat barisan bukit dan pegunungan akan menambah keinginan untuk berfoto ria .
0	bagi anda pecinta keju kafe madtari ini menawarkan olahan makanan seperti , pisang keju , mi rebus atau goreng , roti dan lain-lain yang ditaburi parutan keju yang melimpah yang membuat anda ketagihan dan akan datang lagi ke sini , harga nya yang murah dan terjangkau membuat pecinta keju tentunya sering datang langsung ke sini .
2	saya benar-benar kecewa dengan pelayanan otten ville bandung
2	ciri-ciri orang yang suka menggunjing orang lain yang ada dibawah nya . tidak cocok jadi presiden
0	resto ini sesuai nama nya menyajikan masakan khas belanda dan suasana resto nya pun bernuansa belanda di mana para staf yang melayani memakai baju khas belanda dan tentu ada photo-photo dan hiasan belanda nya . resto ini cocok untuk opa , oma dan keluarga yang ingin bernostalgia . masakan sepetti steak merupakan masakan andalan karena memang rasanya pas .
2	saya sangat kecewa dengan pelayanan kasir dengan wajah judes dan tidak memberikan kesan positif ketika melayani . saya pesan kue ulang tahun ketika billing sudah dicetak ada pesanan yang tidak terinput , si kasir teriak-teriak manggil pelayan yang menulis orderan di depan saya , kemudian setelah dibayar ternyata ada kekurangan lilin angka 24 tidak terinput juga .
2	yang ada cuma kebun selada saja , sudah diganti selada . pas datang lumayan sepi . masih mending di rumah stroberi kalau mau ketik stroberi .
2	tidak tenang
0	kfc yang sudah sangat lama berdiri di bandung sejak sekolah dasar saya sudah makan di sini , lokasi dekat dengan kantor ada tempat bermain anak , resto cukup luas bisa digunakan untuk ulang tahun anak
0	kami ke sini untuk sarapan pagi . biji kopi yang digunakan adalah hasil roast sendiri , sehingga benar-benar biji kopi yang masih segar , dan hasil nya pun kopi yang sangat enak . salah satu dari kami adalah rekan yang berasal dari belgia , dan di negara nya dia biasa makan croissant untuk sarapan . mantap .
0	baru menemukan satu bni yang pewangi ruangan nya butiran biji kopi , wangi nya niqmat .
0	kfc dago terletak di lokasi yang oke banget dan area krc nya sendiri luas banget . terdapat juga brand kfc yang menjual kopi . nyaman banget dah dan jarang harus berebutan kursi . lapang .
0	lokasi yang cukup jauh dari pusat kota , tetapi tidak rugi datang ke sini karena tempat yang teduh sekali banyak pohon dan nuansa bandung yang kental , pokok nya cocok bagi yang ingin keluar dari kehidupan kota , makanan nya enak enak
0	ayam penyet nya enak , porsi bisa lebih banyak . untuk memesan 1 ayam penyet saya masih merasa kurang . sambal kemanggi nua enak , pedas nya pas . sambil diteman live musik dengan berbagai genre , dangdut juga ada .
2	setiap era kepemimpinan pasti punya kekurangan begitu juga dengan era nya pak de . tapi kalau di bandingkan kepemimpinan seorang dengan perbedaan nya jelas bagaikan bumi dan langit , sadar pak . sudah berapa proyek mangkrak dizaman bapak yang di selesaikan pak jokowi .. ??
2	tidak usah lagi kau balik ke indonesia . ceramah kau itu tidak dibutuhkan diindonesia . kerja nya cuma bisa panas - panaskan orang .
0	saya datang bersama suami . yang pasti bukan akhir pekan karena dasar nya kita tidak suka pergi liburan . macet ! . hanya sekitar 4 meja yang terisi kita pilih dibagian luar . udara nya dingin . pelayan nya sigap . makanan nya juga tidak lama menunggu . porsi makanan nya saya banyak menurut saya . jadi tidak usah banyak pesan . sudah kenyang . yang paling keren pemandangan dan penataan lampu nya . we cinta ini restoran .
1	: sekarang kamu bisa menonton apa saja di genflix selama 24 jam .
0	makan di lokasi yang kayak sarang burung ya di sinilah tempat nya . makanan beragam dengan suhu yang dingin tentunya akan menambah selera makan kita . di samping restoran ada tempat bermain cantik buat anak dengan bayar 50 ribu sepuas nya . indah banget . harga makanan cukup mahal tetapi setimpal banget
2	orang islam yang melarang kawin lebih dari 4 sedangkan diri sendiri kawin6 kali . yang paling teruk ialah kawin dengan aishah seorang kanak-kanak berumur6 tahun . agama dah agama ciplak dan nabi adalah hewan gila seks . jadi agama islam adalah agama dajal
2	pada akhir pekan memarin kami dengan beberapa temen janjian bertemu di kedai rumah hayo nya rumah jalan turnojoyo bandung . disuni khusus masakan rumah . dan ada jualan roti-roti dan kue . kami semua datang jam 3:00 sore hanya minum - munum saja . es c tape dan es jeruk dab tak ada yang spesial . kedai ini kosong tamu dikit sekali . sesungguhnya tidak rekomendasi .
0	restoran ini terletak di dago atas , salah satu restoran dengan menu terlengkap yang ada di dago atas . mulai dari makanan indonesia sampai makanan eropa . parkiran cukup luas .
1	go send mulai aktif di cirrebon .
0	makanan di waroeng le cordon benar-benar juara banget enakanyaa terutama sosis dan kentang nya yang beda dari yang lain . terima kasih juga buat pelayanan nya yang super duper cepat , ramah , lalu pemandangan di le cordon juga amazing sekali benar-benar oke pokok nya kami semua tidak menyesal buat mampir lagi ke waroeng le cordon . ditunggu di liburan yang akan datang !
0	jing paradise terletak di jalan setiabudi , yaitu jalan utama menuju tempat wisata lembang . letak nya sangat strategis dan makanan nya enak .
1	adik saya sedang menonton harry potter di trans tv
2	tempat nya bagus . hanya saja playanan nya terkesan judes dan semau nya . kurang senyum . harga termasuk mahal untuk porsi steak salmon dan sirloin yang kecil .
2	crowne plaza hotel bandung , mengecewakan ! jam 16.35 tidak bisa cek in , kata nya kamar masih dibereskan .
0	kalau makan di sini rasa kuah baso nya mantap tidak berlemak , jadi tidak terlalu jijik . sudah begitu bakso nya juga kenyal dan enak . direkomendasikan deh
2	kesal saja dengan kelakuan nyinyir terus kelompok sebelah .
0	salah satu nama batagor yang terkenal di bandung . rasanya nikmat , untuk harga per buah nya rp . 10 ribu . order 3 buah untuk saya cukup mengenyangkan karena ukuran nya per buah nya cukup besar .
0	makanan rumahan terbaik di kota bandung . sesuai dengan nama nyonya rumah , masakan di sini memiliki karakteristik makanan tradisional seperti nasi uduk , dengan ayam , sambal , dan aneka tumisan yang memiliki rasa sangat enak . pasangan saya memesan sate yang memiliki tekstur daging yang lembut dan saus kacang yang terasa . di sini juga disediakan aneka kue basah tradisional . atmosfer tempat ini sangat asik .
2	bekasi ini hobi nya cuma macet doang
1	ganjar pranowo menyebut materi pemeriksaan e-ktp cuma mengulang .
2	aku mau cemburu juga sapu nya hak
0	tong dji menyajikan aneka makan dan minuman , tidak hanya teh . yang direkomendasikan : teh poci gula batu nya dan nasi goreng
2	saya adalah penggemar steak namun ketika saya makan di abuba , ternyata rasanya jauh dari yang pernah dibayangkan bahkan sauce - nya sangat tidak enak seperti sauce abc biasa kata nya barbeque kemudian tidak ada lagi pilihan sauce yang lain . !!! tak mau lagi ke sini
2	prabowo tidak suka orang yang suka mengadu domba sesama nya
0	sudah ada drive - tiru nya . pelayanan cepat , staff nya tidak resep . fasilitas nya lengkap . kebersihan terjaga . ada flat tv .
